Aberlour,"Aberlour es una destilería de whisky escocés de malta, situada en la ciudad homónima: (Aberlour, en  Speyside, Escocia) en el cruce de los ríos  Lour y  Spey cerca de Ben Rinnes. La región de Speyside es la más prolífica región de Escocia en producción de whisky, y donde se sitúan más de la mitad de todas las destilerías de Escocia. Los whiskies de Speyside son reconocidos por su carácter a brezo, que es producto de su proceso de malteado único, el clima local, y sus fuentes de agua.###Root -> Categoría:Bebidas_destiladas -> Categoría:Whisky"
Absenta,"La absenta o ajenjo, apodada la Fée Verte ('El hada verde') o también apodada el Diablo Verde, es una bebida alcohólica de ligero sabor anisado, con un fondo amargo de tintes complejos debido a la contribución de las hierbas que contiene, principalmente Artemisia absinthium. Cuando se le añade agua fría y azúcar, la bebida se transforma en la esencia lechosa (louche). Comenzó siendo un elixir en Suiza, pero fue en Francia donde se hizo popular debido a la asociación entre los artistas y escritores que tomaban esta bebida en el París de finales del siglo XIX hasta que se prohibió su producción en 1915. La marca más popular durante el siglo XIX fue Pernod Fils hasta su prohibición. Durante la belle époque el nombre se convirtió en sinónimo de la bebida y la marca representó el estándar de calidad de facto por el cual se juzgaba a todas las demás.###Root -> Categoría:Bebidas_destiladas -> Categoría:Absenta",Absinthe,Absentha
Absolut Vodka,"Absolut Vodka es una marca de vodka de origen sueco, propiedad del grupo Pernod Ricard. Su origen se remonta a 1879 y durante décadas formó parte del grupo Vin & Sprit. Se trata de la tercera marca de bebida blanca más consumida a nivel mundial, por detrás de Bacardí y Smirnoff. Absolut sigue la filosofía ""One Source"", basada en que todo proceso de fabricación de sus vodkas (agua,semillas y destilación) provienen del pueblo donde están establecidos (Åhus), por tanto, se contamina muy poco.[1]​ Además, sus emisiones en la destilación son neutrales (0% de CO2) debido a que plantan una cantidad de árboles en proporción al gasto de CO2 que emiten.[2]​###Root -> Categoría:Bebidas_destiladas -> Categoría:Vodka -> Categoría:Marcas de vodka",Absolut,Absolut Citron,Absolut citron,Absolut vodka
Advocaat,"El advokaat o advocaat es una bebida muy similar al rompope, que se consume en Alemania, Bélgica y Países Bajos. Se trata también de un licor denso, preparado con huevo, brandy o ginebra, aromatizado con vainilla, café o chocolate. La graduación de este licor está entre 15 y 20 grados. El advokaat se prepara usando solo las yemas. Una variante muy poco conocida y extendida es la que se hace con el huevo completo, que es una versión menos espesa, aunque generalmente está destinada a la exportación.  Muchos neerlandeses gustan de servir el advokaat con una capa de nata montada encima. Se sirve frío y en servicio de licor, y agitado previamente. En las Antillas se mezclaría la pulpa del aguacate con ron; y en algunas zonas, con ron envejecido (""oscuro"") o sin envejecer (""blanco"" o ""transparente""). Cuando esta costumbre se importó a Europa, los aguacates, una fruta exótica imposible de encontrar entonces en Europa, se sustituyeron por huevo.   == Referencias ==###Root -> Categoría:Bebidas_destiladas -> Categoría:Licores"
Agave tequilana,"Agave tequilana (agave tequilero) es una especie de plantas suculentas perteneciente a la antigua familia de las agaváceas, ahora subfamilia Agavoideae.###Root -> Categoría:Bebidas_destiladas -> Categoría:Tequila",Tequila agave,Agave palmaris,Agave pedrosana,Agave pes-mulae,Agave pseudotequilana,Agave pes mulae,Agave angustifolia subsp. tequilana,Agave palmeris
Aguardiente de madroño,"Aguardiente de Madroños es una bebida de aguardiente de Portugal, obtenido del fruto del árbol Arbutus unedo, también llamado madroño. Los árboles de madroño crecen en forma silvestre en los suelos pobres en las zonas rurales de Portugal como el Alentejo y el interior del Algarve. No hay ninguna plantación comercial de los árboles y los frutos se recolectan sobre todo por los agricultores locales, y a mano se procesan en privado. Por lo tanto, el Aguardiente de Madroños no se pueden comprar en los supermercados, sino directamente de los agricultores. Muy pocos agricultores tienen una licencia para la destilación, pero son tolerados por las autoridades para mantener viva esta especialidad tradicional portuguesa. Aguardiente de Madroños es muy popular entre la gente común, como los agricultores y pescadores. Cuando se endulza con miel que se llama Brandymel.[1]​###Root -> Categoría:Bebidas_destiladas",Aguardiente de madrono
Aguardiente de Ojén,"El aguardiente de Ojén, anís de Ojén o, sencillamente, el ojén (término iniciado en minúscula cuando no es topónimo[1]​), es un tipo de aguardiente de vino, dulce y anisado, fabricado en Ojén, un pueblo de la provincia de Málaga, en Andalucía (España). La receta necesaria para su elaboración ha ido cambiando desde que fue inventada en 1830, pero tradicionalmente el ojén se fabricaba utilizando ingredientes que provenían única y exclusivamente del pueblo de Ojén: se destilaba vino elaborado a partir de las viñas locales (principalmente de uva moscatel), se usaba madera de enebro que debía ser quemada alcanzado un cierto punto en el proceso de elaboración, se usaban ramas de anís para aromatizar la destilación y finalmente se utilizaba el agua de la fuente del pueblo para rebajar la graduación en alcohol, estabilizando el volumen de éste en 40 grados, aunque en la actualidad se estabiliza a 37,5 grados. La historia de la fabricación de esta bebida ha atravesado tres etapas bien diferenciadas, separadas entre ellas por dos largos períodos de interrupción, uno de 42 años entre 1919 y 1961 y otro de 39 años entre 1974 y 2013:  1830-1919: «Pedro Morales e hijo, Ojén, aguardiente superior» 1961-1974: «Juan Espada Fernández, Ojén, aguardiente superior» Desde 2013: «Dominique Mertens Impex. S.L., Ojén, aguardiente superior»###Root -> Categoría:Bebidas_destiladas",Aguardiente de Ojen,Una copita de Ojén
Aguardiente de Rute,El aguardiente de Rute (denominado también ruteño[1]​ o anís de Rute) es un aguardiente seco anisado típico de la cocina cordobesa. Este destilado de alta graduación (45º-55º) procede de las destilerías artesanales ubicadas en el municipio de Rute y Baena (provincia de Córdoba) desde el siglo XVII.[2]​ Una de sus marcas más populares es el anís Machaquito (elaborado desde 1876 por Hijo de Rafael Reyes S.A.).###Root -> Categoría:Bebidas_destiladas -> Categoría:Licores -> Categoría:Licores de España,Anís de Rute
Aguardiente,"El aguardiente es una bebida alcohólica destilada de un fermentado alcohólico. Existe una gran variedad de sustancias orgánicas agrícolas cuya pasta o jugo fermentado es usado para su extracción, incluyendo frutas, cereales, hortalizas y granos. Los aguardientes provienen de multitud de plantas ricas en sacarosa, que es el elemento esencial en la elaboración de la bebida (ya que a partir de esta surge el etanol), siendo en principio el aguardiente alcohol diluido en agua. Toma así el aguardiente su nombre de «Aqua» y «Ardiente» del latín «Ardens», lexema «Ardie», refiriéndose a su baja inflamabilidad, aunque también se dice que el nombre se debe a la sensación propia de la sustancia líquida alcohólica al ser ingerida. «Aguardiente» puede referirse prácticamente a cualquier bebida alcohólica obtenida por destilación, pero el nombre se aplica sobre todo a aquellas que poseen entre un 30 % y un 59 % de grado o volumen de alcohol (véase graduación alcohólica). Si bien la aparición de la elaboración de bebidas destiladas se relaciona con el uso de alambiques y alquitaras por alquimistas árabes en la antigüedad, los métodos de destilación no se desarrollaron completamente hasta finales de la Edad Antigua y principios de la Edad Media. La fabricación de bebidas destiladas se extendió por toda Europa y el resto del mundo, dando paso a una gran variedad de sabores, colores y aromas, que se dan en función del tipo de destilación, de la materia prima destilada y de los diferentes aditivos. Estas propiedades cambian de una cultura a otra de acuerdo a las costumbres, así como el uso mismo del término aguardiente.###Root -> Categoría:Bebidas_destiladas",Aguardiente de uva,Aguardientes,Aguardiente de caña
Albariza,"La albariza es un tipo de suelo que cubre las campiñas de Montilla-Moriles y el Marco de Jerez.[1]​A veces se denominan ""las afuera""[2]​###Root -> Categoría:Bebidas_destiladas -> Categoría:Vinos generosos -> Categoría:Jerez"
Alcopop,"Los alcopops son licores comercializados en pequeñas botellas (típicamente entre 200–275ml) de diseño y etiquetado confuso ya que la botellas hacen pensar en bebidas de bajo contenido alcohólico. Una botella puede llegar a contener por término medio entre un 5,5% o un 7.00% de alcohol, es decir una graduación alcohólica mucho mayor que la mayoría de las cervezas. En la industria de la elaboración de bebidas alcohólicas se conoce a estas bebidas como RTD (ready to drink) o también FAB (Flavoured Alcoholic Beverages). En Europa los alcopops tienden a ser una pre-mezcla de alcohol fuerte como vodka (por ejemplo: Smirnoff Ice) o ron (por ejemplo: Bacardi Breezer). En Estados Unidos los alcopops son mezclas de alcohol con cerveza y alguna sustancia saborizante.###Root -> Categoría:Bebidas_destiladas -> Categoría:Licores",Alcopops
Alexander,"El cóctel Alexander es una mezcla de diferentes bebidas entre ellas la ginebra, el licor de cacao incoloro y nata.[1]​ El Alexander es la base de otras recetas de cócteles, como por ejemplo el más común Brandy Alexander.###Root -> Categoría:Bebidas_destiladas -> Categoría:Ginebra (bebida) -> Categoría:Cócteles con gin",Alexander (coctel)
Allt A'Bhainne,"Allt A'Bhainne (arroyo de la leche en gaélico) es una destilería de whisky escocés de malta situada a la orilla del arroyo Bhainne, al sur de Dufftown, en la región de Speyside.###Root -> Categoría:Bebidas_destiladas -> Categoría:Whisky"
Almacenista,"En el marco vitívinícola de Jerez, se conoce tradicionalmente como almacenista al empresario que se dedica a la elaboración y envejecimiento del vino a partir de la uva que le proporcionan los cosecheros en unos casos, o a partir del mosto en otros. El proceso de producción puede durar entre cuatro y seis años y que una vez terminado, es vendido al exportador o también denominado extractor.  Los extractores, que incluyen a las grandes bodegas de Jerez, combinan y clasifican los vinos y disponen de una red comercial en el exterior y son los encargados de su comercialización.[1]​ Los almacenistas solían suministrar solo una parte de la producción de las bodegas comercializadoras, el denominado cupo, cuando así lo necesitaban estas.[2]​ Se llegaron a contar más de 130 almacenistas activos en el marco de Jerez, en el momento más álgido de esta forma de producción. Sin embargo la estructura productiva del sector en esta área ha ido cambiando porque una parte de los almacenistas se han lanzado a comercializar de forma directa al público sus caldos y por otra las grandes bodegas que se suministraban de los almacenistas, acumulan ahora vinos añejos y han ido prescindiendo de los almacenistas. Dentro de los almacenistas tradicionales que pasaron a expedidores y se han introducido en el  mundo de la comercialización, destacan Pilar Aranda, el Maestro Sierra, Gaspar Florido, almacenista entre su fundación en 1942 y 1997 y Lustau, que se creó en 1896 y pasó a comercializar su marca en los años cincuenta del siglo XX.[2]​    == Referencias ==###Root -> Categoría:Bebidas_destiladas -> Categoría:Vinos generosos -> Categoría:Jerez"
Amaretto,"El amaretto (diminutivo de amaro, literalmente en italiano ""amarguito"" o ""un poco amargo"") es un licor dulce originario de Saronno, en el norte de Italia.  El amaretto combina el dulzor de los huesos de albaricoque con el amargo de las almendras, los cuales están acompañados por alcohol puro, azúcar caramelizada y la esencia de diecisiete plantas y frutas aromáticas, entre las que destaca de forma especial la vainilla, aunque tiene también melocotón (durazno) y cereza. Su graduación alcohólica suele rondar los 25 grados y no supera en ningún caso los 30.###Root -> Categoría:Bebidas_destiladas -> Categoría:Licores -> Categoría:Licores de Italia",Amareto,Apricot
Amargo de Angostura,"El amargo de Angostura, es un ingrediente muy apreciado en la elaboración como bíter (amargo) en cócteles, y también como condimento de sopas y salsas. De sabor amargo con contenido alcohólico del 44,7 % en volumen, se usa en pequeñas cantidades para dar un toque a diferentes mezclas. Fue creado en Venezuela con propósitos medicinales por el médico alemán Johann Gottlieb Benjamin Siegert, dándole el nombre de la ciudad de origen.###Root -> Categoría:Bebidas_destiladas -> Categoría:Licores -> Categoría:Bíteres",Angostura (bebida),Amargo de angostura,Angostura bitters
Amargo,"El Código Alimentario Argentino denomina amargo a todo aquella bebida cuyo sabor sea predominantemente amargo, lo cual permite incluir dentro de esta categoría al fernet.[1]​En la práctica, se designa de esta manera a una bebida no alcohólica a base de hierbas, de sabor muy concentrado. Por esto, es común que se le agregue soda y se adapten los niveles de cada bebida de la mezcla de acuerdo al gusto de quien la prepara.[2]​ La producción argentina de aperitivos amargos entre 1992 y 1997, duplicó su volumen de producción, alcanzando 80 millones de litros anuales.[3]​###Root -> Categoría:Bebidas_destiladas -> Categoría:Licores -> Categoría:Bíteres"
Amaro,"El amaro (‘amargo’ en italiano, plural amari) es un tipo de licor de hierbas italiano que suele tomarse tras las comidas como digestivo. Suele ser amargo y dulce, a veces almibarado, con un contenido en alcohol habitualmente entre el 16 y el 35%. El amaro suele producirse macerando hierbas, raíces, flores, cortezas y piel de cítricos en alcohol, ya sea en licores neutrales o vino, mezclando tras filtrar con almíbar y dejando envejecer la mezcla en tonel o botella. Se producen comercialmente docenas de variedades, siendo las más difundidas las de Averna, Ramazzotti, Lucano y Montenegro. Un amaro típico está elaborado con varias (a veces varias docenas) de hierbas y raíces. Algunos fabricantes enumeran con cierto detalle los ingredientes en la etiqueta de la botella. Es típico que el amaro incluya: genciana, angélica y quina, así como melisa, verbena, enebro, anís, hinojo, cúrcuma, jengibre, menta, tomillo, salvia, laurel, piel de cítrico, regaliz, canela, poleo, cardamomo, azafrán, ruda, ajenjo, saúco y centáurea menor. Muchos fabricantes remontan su receta o producción al siglo XIX. Las recetas surgieron a menudo en monasterios o farmacias. Los amari suelen tomarse con hielo y un trozo de limón, o mezclados con tónica. El amaro no debe confundirse con el amaretto, otro licor italiano que es dulce y está aromatizado con almendra o los piñones de frutas tales como el albaricoque, ni con el amarone, un vino rojo seco italiano de Valpolicella###Root -> Categoría:Bebidas_destiladas -> Categoría:Licores -> Categoría:Licores de hierbas",Amaro (bebida),Licor Amaro
Amaro Lucano,"Amaro Lucano es un licor de hierbas italiano, originario de la región de Basilicata. Fue creado en 1894 por el pastelero Pasquale Vena, de la mezcla de más de 30 hierbas.[1]​   En 1900 Amaro Lucano ganó notoriedad en todo el Reino de Italia, después de la familia Vena se convirtiò proveedor oficial de la Casa de Saboya,[1]​ cuyo escudo de armas aparece en la etiqueta.  En 2014, fue reconocido con tres estrellas por el Superior Taste Award.[2]​   Amaro Lucano tiene un color marrón caramelo y un sabor amargo/dulce con un contenido de alcohol del 28% por volumen. Se puede tomar solo, frío, con hielo o con una rodaja de naranja. También está indicado como base para cócteles.[1]​###Root -> Categoría:Bebidas_destiladas -> Categoría:Licores -> Categoría:Licores de hierbas"
Amaro Montenegro,"Amaro Montenegro es un amaro tradicional de Bolonia, Italia. Está fabricado con cuarenta hierbas.###Root -> Categoría:Bebidas_destiladas -> Categoría:Licores -> Categoría:Licores de hierbas"
Amarula,"Amarula es una crema de licor a base de azúcar, crema y fruto de marula fermentada. Su contenido alcohólico alcanza un 17% y es de un sabor a caramelo y frutas. Ha tenido cierto éxito internacional en competiciones de bebidas alcohólicas, ganando una medalla de oro en la San Francisco World Spirits Competition de 2006.[1]​ Fue comercializado inicialmente como licor en septiembre de 1989, habiéndose lanzado en 1983 como bebida alcohólica.[2]​ Tiene un ligero sabor a caramelo de fruta. Amarula ha recibido críticas consistentemente buenas, con el defecto, como muchos licores crema, de ser demasiado dulce para algunos paladares. Se ha convertido en la segunda crema de licor más vendida tras el Baileys Irish Cream, con especial éxito en Brasil.[3]​ Es muy popular y común en toda África, especialmente en el sur y la costa este. Recientemente Amarula ha intentado introducirse en el mercado estadounidense.   == Referencias ==###Root -> Categoría:Bebidas_destiladas -> Categoría:Licores -> Categoría:Licores de fruta"
Amatitán,"Amatitán es un municipio y población del estado de Jalisco, México. Se localiza en la Región Valles. Su nombre proviene del náhuatl -Amatl (Amate) y an (lugar) y significa ""Junto a los Amates"", su extensión territorial es de 207.44 km². Según el II conteo de población y vivienda, el municipio tiene 13,435 habitantes y se dedican principalmente al sector primario y secundario.[5]​ Amatitán es conocido por ser uno de los productores de tequila más importantes del mundo, donde se originó esta bebida .###Root -> Categoría:Bebidas_destiladas -> Categoría:Tequila -> Categoría:Paisaje agavero y antiguas instalaciones industriales de Tequila",Amatitan
Americano,"El Americano es un cóctel italiano hecho exclusivamente con productos italianos: bitter Campari, Vermouth rojo y seltz. Es un cóctel oficial de la IBA.###Root -> Categoría:Bebidas_destiladas -> Categoría:Vinos generosos -> Categoría:Vermú -> Categoría:Cócteles con vermú"
Amontillado,"El amontillado es un vino generoso propio de Montilla y del Marco de Jerez, Andalucía (España). Por sus características enológicas se halla entre el fino y el oloroso.[1]​ Este vino adquiere el nombre por su método de elaboración.###Root -> Categoría:Bebidas_destiladas -> Categoría:Vinos generosos -> Categoría:Jerez"
Ángel azul,El Ángel azul es un cóctel alcohólico italiano.###Root -> Categoría:Bebidas_destiladas -> Categoría:Ginebra (bebida) -> Categoría:Cócteles con gin
Anisado,"Los anisados son bebidas a partir de distintos tipos de maceraciones del anís con otros compuestos. Suelen producirse en España (principal productor), sur de Francia (pastis de Marsella) y países andinos, como Colombia y  Perú.[1]​###Root -> Categoría:Bebidas_destiladas",Anisados
Anís del Mono,"Anís del Mono es una marca registrada de anís con origen en la ciudad  de Badalona (Barcelona) en Cataluña, España. Es empleada en la repostería española desde el siglo XIX.###Root -> Categoría:Bebidas_destiladas -> Categoría:Licores -> Categoría:Licores de España",Anis del mono,Anis del Mono
Anís La Castellana,"Anís La Castellana es una marca registrada de anís[1]​ de origen español, elaborada en Palazuelos de Eresma (Segovia )desde el año 1894 en la fábrica familiar del industrial y financiero segoviano Nicomedes García Gómez.[2]​ Este licor está elaborado en un destilado de grano de anís y badiana, mezclados con agua desmineralizada, jarabe de azúcar y alcoholes de melaza, y se comercializan dos variantes, una dulce con una graduación alcohólica de 35º y otra seca, de 45º.###Root -> Categoría:Bebidas_destiladas -> Categoría:Licores -> Categoría:Licores de España",Anis La Castellana
Anís paloma,"El anís paloma es un licor español. Se elabora en la localidad de Monforte del Cid (Alicante), España. Con él se suele hacer un combinado-aperitivo, llamado solamente Paloma, que consiste normalmente en 3-4/5 partes de agua y 1-2/5 partes de Anís Paloma (el cual debe ser Seco) es una bebida que se acostumbra a tomar a la hora del aperitivo en determinadas ciudades de la zona: Torrevieja, Elche, Alicante, Torrelamata, y también en algunos municipios de la cercana Región de Murcia. La receta es la siguiente: •Anís Seco-Paloma •Agua mineral •Hielo (es lo último que se añade para que no se corte el anís).###Root -> Categoría:Bebidas_destiladas -> Categoría:Licores -> Categoría:Licores de España",Anis paloma
Aperol,"Aperol  es una bebida alcohólica de origen italiano producida originalmente por la empresa Barbieri con sede en Padua. Aperol ahora es producido por el Grupo Campari. El origen de este licor se remonta a 1919,[1]​ pero solo se volvió popular después de la Segunda Guerra Mundial. Entre sus ingredientes se encuentran la naranja amarga, el ruibarbo, la genciana y la quina. Aunque sabe y huele muy similar al Campari, Aperol tiene una graduación alcohólica  de 11%, menos de la mitad que Campari. Sin embargo, es más suave y menos amargo, mientras que el Campari es más oscuro de color. El Aperol que se vende en Alemania tiene 15% de alcohol para evitar regulaciones locales.###Root -> Categoría:Bebidas_destiladas -> Categoría:Licores -> Categoría:Bíteres"
Appletini,"El Apple Martini o Martini de manzana (Appletini para abreviar) es un cóctel que contiene vodka y uno o más jugos de manzana, sidra de manzana, licor de manzana o brandy de manzana. Esta bebida fue originalmente llamada Adam's Apple Martini, porque el cantinero que la creó se llamaba Adam, fue creada en 1996 en el restaurante Lola's West Hollywood.[1]​[2]​ La Adam's Apple fue anunciada por Smirnoff en la edición de julio de 1972 de la revista Playboy en la portada interior. La receta requería una onza de Smirnoff y jugo de manzana en un vaso alto con hielo.###Root -> Categoría:Bebidas_destiladas -> Categoría:Vodka -> Categoría:Cócteles con vodka",Apple Martini,Apple martini,Martini de manzana
Aqua vitae,"El aqua vitae (en latín literalmente ‘agua de vida’), es un nombre arcaico para una solución acuosa concentrada de etanol. No debe ser confundida con el aquavit.  El aqua vitae se preparaba típicamente destilando vino, por lo que a veces era conocida como «Espíritu del Vino» en textos ingleses, siendo este un nombre específico para el brandy que ha sido destilado repetidamente. En lo general aun ahora, se aplica a ciertos aguardientes afrutados. El nombre fue familiarmente usado para los principales licores destilados de cada región. De esta forma, se llamaba así al usquebaugh o whisky en Escocia e Irlanda, geneva o ginebra en Holanda. Muy común el uso del término en francés, eau de vie (plural: eaux de vie), aplicado a los licores o aguardientes basados en diversas frutas y obtenidos mediante un proceso de fermentación y doble destilación.###Root -> Categoría:Bebidas_destiladas -> Categoría:Licores"
