Hideous,"Hideous es un licor con sabor cítrico y de frutas rojas fabricado por Hideous, L.C., una compañía estadounidense. Tiene 70º (35% de alcohol por volumen), color magenta y un sabor suave y dulce. La compañía lo promociona para ser consumido como chupito, así como en mezclas, apareciendo en varias recetas. Ha sido comparado en sabor al cóctel llamado Cosmopolitan.[1]​ El licor se hace a partir de alcohol rectificado de patata y maíz, con aromas naturales añadidos procedentes de fruta roja cultivada en el estado de Washington (incluyendo frambuesas y otras) y cítricos. El alcohol base se producido por Distilled Resources Inc. en Rigby (Idaho), siendo Hideous uno de los único cuatro fabricantes de licor que elabora su propio alcohol neutro.[2]​ El fundador y propietario de Hideous, L.C. es Michael E. Klein, oriundo de Nueva Orleans (Luisiana). Desarrolló la marca cuando era estudiante en la Universidad de Texas en Austin. La compañía tiene su sede en Nueva Orleans, pero la mayoría del negocio se gestiona desde su oficina de Austin (Texas). El licor está disponible en los estados de Georgia, Tenesi, Luisiana, Texas, Idaho, Montana, Washington, Wyoming y Oregon.###Root -> Categoría:Bebidas_destiladas -> Categoría:Licores -> Categoría:Licores de fruta"
Hierbas Ibicencas,"Las Hierbas Ibicencas es una bebida espirituosa anisada con extractos de aromas de diversas plantas y con un grado variable de edulcoración. Se elaboran desde hace más de 200 años, mediante la maceración hidroalcohólica de diferentes plantas y con la presencia de anís.###Root -> Categoría:Bebidas_destiladas -> Categoría:Licores -> Categoría:Licores de España"
Holcatzín,"El holcatzín es un licor típico de la península de Yucatán, en México, a base de capulines (un tipo de fruta local parecido a la cereza) macerados en aguardiente de caña.[1]​ En Campeche también es conocido como «holgatzín» o simplemente «licor de capulín».[2]​###Root -> Categoría:Bebidas_destiladas -> Categoría:Licores -> Categoría:Licores de fruta -> Categoría:Licores y licores de cereza",Licor de capulín
Horse's Neck,"El Horse's Neck (en inglés, /ˈhɔː.sɪz.nɛk/ «cuello de caballo») es un cóctel de origen estadounidense, con reconocimiento IBA, que consiste en brandy, ginger ale y amargo de Angostura, y tradicionalmente luce una tira larga rizada de piel de limón como garnish.[1]​###Root -> Categoría:Bebidas_destiladas -> Categoría:Brandy -> Categoría:Cócteles con brandy"
Hpnotiq,"El Hpnotiq es un licor de fruta azul con 17° de alcohol hecho de vodka, coñac y zumo de fruta tropical. Está disponible en unos 35 países. El Hpnotiq es el cuarto licor importado en ventas en Estados Unidos, según Adams Beverage Media.###Root -> Categoría:Bebidas_destiladas -> Categoría:Licores -> Categoría:Licores de fruta"
Hrenovuha,"Hrenovuha (en ucraniano, Хріновуха, en ruso, Хреновуха) es un tipo de vodka fuerte, común en Ucrania y Rusia. Posee un sabor amargo, y se lo prepara usando la raíz del rábano picante, a menudo con diversas especias, tales como granos de pimienta y ajo.[1]​ El hrenovuha es fácil de preparar en el hogar. Su preparación en las casas se remonta a una antigua tradición. A comienzos del siglo XVIII Pedro I promulgó un decreto indicando que en cada establecimiento agropecuario se debía producir vodka. La palabra ""hrenovuha"" es propia del lenguaje cotidiano y no registra raíces conocidas. Sin embargo el alcohol de rábano picante es servido bajo esta denominación en muchos restaurantes.[2]​[3]​[4]​[5]​ La planta KIN1 en Moscú produce esta bebida.[6]​   == Referencias ==###Root -> Categoría:Bebidas_destiladas -> Categoría:Vodka"
Jack Daniel's,"Jack Daniel's es una destilería y marca de whiskey estadounidense de Tennessee. La diferencia más notable es que el whisky Tennessee es filtrado en carbón de arce sacarino, dándole un sabor y aroma distintivos. Conocida por sus botellas cuadradas y su etiqueta de color negro, la compañía fue establecida en Lynchburg, Tennessee y adquirida por la compañía Brown-Forman en 1957.###Root -> Categoría:Bebidas_destiladas -> Categoría:Whisky -> Categoría:Marcas de whisky",Jack Daniels
Jägerbomb,"El Jägerbomb (pronunciación inglesa y alemana /ˈjeɪɡərˌbɒm/, usualmente en castellano /'jageɾˌbom(b)/) o Red Bull Blaster[1]​ es un cóctel o chupito hecho con el licor de hierbas alemán Jägermeister y la bebida energizante austríaca Red Bull. Erróneamente se suele escribir con doble g.  Tiene una forma tradicional de servirse, que es vertiendo el Jägermeister en un vaso de chupito, el Red Bull en un vaso de rocas y colocando el vaso pequeño dentro del grande. También es tradicional servir una ronda de Jägerbombs formando un Jägertren, es decir, disponiendo los vasos en hilera y haciendo caer los vasos de chupito adentro de los vasos grandes en un «efecto dominó». También se sirve en vaso de tubo, en proporciones 4:6, o bien como chupito a partes iguales.###Root -> Categoría:Bebidas_destiladas -> Categoría:Licores -> Categoría:Cócteles con licor",Jäger Bomb,Jaggerbomb,Jagerbomb,Red Bull Blaster
Jägermeister,"Jägermeister  es un licor de hierbas endulzado, pero con un dejo amargo, el cual tiene 34,5% de contenido alcohólico. Es muy popular en Baja Sajonia en la ciudad de Wolfenbüttel (Alemania). En esta ciudad se encuentra la raíz de la empresa que la comercializa: Mast-Jägermeister SE. En Sajonia, así como en Wittmar (Baja Sajonia), existen dos de las instalaciones principales. La receta secreta de este licor alemán, denominado Jägermeister (en alemán: ""guarda de caza""; literalmente: maestro de caza), se prepara con 56 hierbas diferentes. La popularidad de esta bebida ha tenido tanta fuerza que a finales de los años 1990 llegó hasta la clase media de los Estados Unidos. Inclusive es común encontrar cócteles hechos a base de este licor; entre ellos figura el Jägerbomb. Puede mezclarse con bebidas energizantes, tales como el Red Bull (conocida como JägerBomb - Perla Negra) u otros como el RipperMeister mezclado con Monster Energy Ripper (que contiene 50% de zumo tropical). Sin embargo, según la página oficial, su elaboración ha sido pensada para un consumo sin mezcla alguna.###Root -> Categoría:Bebidas_destiladas -> Categoría:Licores -> Categoría:Bíteres",Jagermeister,Jaegermeister
Jameson,"Jameson es un whiskey irlandés mezclado (blended), producido por primera vez en 1780. Originalmente uno de los cuatro whiskys más importantes de Dublín, hoy en día es destilado en Cork (Irlanda), aunque la mezcla sigue llevándose a cabo en Dublín. Las ventas anuales superan los 22 millones de botellas, haciendo de Jameson el whisky irlandés más vendido del mundo.[1]​###Root -> Categoría:Bebidas_destiladas -> Categoría:Whisky -> Categoría:Marcas de whisky",Whiskey Jameson
Jerez,"El jerez (en inglés sherry y en francés xérès) hace referencia a una amplia gama de vinos españoles que se cría en las ciudades andaluzas de Jerez de la Frontera, El Puerto de Santa María y Sanlúcar de Barrameda,[1]​ aunque la zona de producción de estos vinos abarca también los municipios de Chiclana de la Frontera, Chipiona, Puerto Real, Rota, Trebujena y Lebrija (este último en la provincia de Sevilla). El conjunto geográfico formado por la zona de producción y la zona de crianza del jerez se conoce con el nombre de Marco de Jerez. Esta especialidad vínica es un elemento clave en la historia de los municipios que integran el Marco y en la identidad cultural de sus habitantes.###Root -> Categoría:Bebidas_destiladas -> Categoría:Vinos generosos -> Categoría:Jerez",Vino de Jerez,Sherry,Xérès,Vino de Jeréz,Vino de Jérez,Xérèz,Marco de Jerez,Jerez (vino),Xeres,Vinos de Jerez
Jim Beam,"Jim Beam es una marca norteamericana de whisky de Bourbon producida en Clermont, Kentucky. Fue una de las marcas más vendidas durante el año 2008. Desde 1795 (excepto por la prohibición) fue producido por siete generaciones de la familia Beam.  Fue nombrado ""Jim Beam"" en el año 1933 en honor a Jonbas Böhm Aus Kuchen, quien renovó la marca después de la prohibición. La marca hoy es propiedad y producida por Beam Inc. (NYSE: BEAM), compañía fundada el 4 de octubre de 2011, parte del holding llamado con anterioridad Fortune Brands. La familia Beam sigue involucrada en el negocio. La sede de Beam se encuentra en los suburbios de Chicago, Illinois.[1]​ La compañía produce distintas cantidades de Bourbon, otros licores y comidas que incluyen Bourbon como ingrediente. Una de ellas es la salsa Bourbon, un aderezo característico de carnes y otros alimentos preparados en la barbacoa.[2]​  El 13 de enero de 2014, Suntory Holdings, una compañía japonesa anunció planes de comprar Jim Beam por 16 mil millones de dólares.[3]​   == Referencias ==###Root -> Categoría:Bebidas_destiladas -> Categoría:Whisky -> Categoría:Bourbon"
John Collins,"Un John Collins es un cóctel qué fue mencionado en 1869, pero puede ser anterior. Se cree que tuvo su origen con un mesero de aquel nombre quién trabajaba en Limmer's Old House en la calle Conduit en Mayfair, el cual era un popular hotel y café de Londres entre 1790 –1817.[1]​[2]​###Root -> Categoría:Bebidas_destiladas -> Categoría:Ginebra (bebida) -> Categoría:Cócteles con gin"
John Daly,"El John Daly (/dʒɑn.ˈdæ.li/) es un cóctel que consiste en limonada, té helado y vodka, llamado así por el golfista estadounidense John Daly. También se puede hacer con limonada y vodka de sweet tea (una infusión de vodka).[1]​[2]​ La bebida es una versión alcohólica del Arnold Palmer (también llamado así por un golfista estadounidense, Arnold Palmer). El nombre es un guiño irónico a los problemas de Daly con el abuso del alcohol.[3]​ La bebida se hizo popular en el Whiskey Creek Golf Course, en Fort Myers, Florida por el cantinero Daton Lewis durante la carrera de Daly en 2005 en el Dirty Gator Open. Daly consideró el uso de su nombre sin autorización como una infracción contra una marca registrada.[4]​ En respuesta, Daly formó la Compañía de Bebidas GIASI en 2010 con dos de sus amigos cercanos. Daly es el accionista mayoritario. GIASI significa Grip It And Sip It («agarre y sorba»), un juego de palabras de su frase Grip it and Rip it («agarre y rasgue»). Embotellado por Frank-Lin Distiller en Fairfield, California, el cóctel original oficial John Daly llegó al mercado en 2013. Del alcance inicial en California y Nevada, se extendió a 13 estados, incluido su estado natal de Arkansas, Texas e Illinois. GIASI ofrece tres sabores diferentes del cóctel ready to drink a base de vodka ABV de 30 pruebas: sweet tea / limonada, té de durazno / limonada y té / limonada de frambuesa.[5]​###Root -> Categoría:Bebidas_destiladas -> Categoría:Vodka -> Categoría:Cócteles con vodka",John Daly (cocktail)
Johnnie Walker,"Johnnie Walker[1]​ es una marca de whisky escocés ahora propiedad de Diageo que se originó en la ciudad escocesa de Kilmarnock, East Ayrshire. La marca fue establecida por primera vez por el tendero John Walker. Es la marca de whisky escocés mezclado más ampliamente distribuida en el mundo, vendida en casi todos los países, con ventas anuales equivalentes a más de 223.7 millones de botellas de 700 ml en 2016 (156.6 millones de litros).###Root -> Categoría:Bebidas_destiladas -> Categoría:Licores"
Julepe de menta,"El julepe de menta (también conocido por su nombre en inglés, mint julep /mɪnt.ˈdʒu.lɪp/) es un cóctel alcohólico típico del sur de Estados Unidos.###Root -> Categoría:Bebidas_destiladas -> Categoría:Whisky -> Categoría:Cócteles con whisky",Mint-julep,Mint julep
Justerini & Brooks,"Justerini & Brooks, más conocido como J&B, es el tercer whisky escocés más vendido del mundo, [cita requerida] tras Johnnie Walker y Ballantine's, siendo líder de ventas en España. Es distribuido por la compañía Diageo. J&B es fruto de la locura de sus creadores por hacer un blended con un perfecto balance y equilibrio en aroma y sabor.###Root -> Categoría:Bebidas_destiladas -> Categoría:Whisky -> Categoría:Marcas de whisky",J&B
Kahlúa,"Kahlúa es un licor de café mexicano, reconocido en el mercado internacional por su textura densa y sabor dulce, con un distintivo aroma y sabor a café, y un suave aspecto de barniz natural.###Root -> Categoría:Bebidas_destiladas -> Categoría:Licores",Kahlua
Kamikaze,"Este combinado tiene el vodka como principal ingrediente, y su origen es posterior a la Segunda Guerra Mundial, o al menos de 1945, cuando empezó a generalizarse el término.###Root -> Categoría:Bebidas_destiladas -> Categoría:Vodka -> Categoría:Cócteles con vodka",Kamikaze (coctel),Vodka Sour
Kaoliang,"Kaoliang jiu (Hanyu Pinyin: gāoliáng jiǔ) (literalmente ""licor de sorgo"", a menudo llamado simplemente kaoliang o vino de sorgo) es un fuerte destilado de licor, a partir de fermentados de sorgo (que se llama gāoliáng en chino). Se hacen y se venden tanto en la China continental y Taiwán, y también es popular en Corea, donde se le llama goryangju (hangul: 고량주; hanja :高粱酒).[1]​ Kaoliang de es un producto importante de las islas de Kinmen y Matsu, que están bajo la jurisdicción de Taiwán. Kaoliang tiene un rango de entre 38 y 63 por ciento de alcohol por volumen.###Root -> Categoría:Bebidas_destiladas"
Khortytsa,"Khortytsa es una marca de vodka premium de origen ucraniano. Elaborado en la destilería Khortytsa (Jortytsia), llamada así en homenaje a la isla donde se encuentra. Esta isla posee ideales condiciones ecológicas que favorecen la producción del vodka. Actualmente es el vodka más vendido de Ucrania y otros países de Europa. Se comercializa en botellas de 0,5L, 0,75L y 1L y se caracteriza por ser el vodka más protegido del mundo contra falsificaciones.###Root -> Categoría:Bebidas_destiladas -> Categoría:Vodka -> Categoría:Marcas de vodka",Khortytsa vodka
Kir,El Kir es un popular cóctel francés elaborado con crema de cassis (licor de grosella negra) y vino blanco. Se trata de un cóctel que se toma como aperitivo antes de la comida.###Root -> Categoría:Bebidas_destiladas -> Categoría:Licores -> Categoría:Cócteles con licor,Cóctel Kir,Coctel Kir
Kir Royal,"El Kir Royal es un popular cóctel francés elaborado con crema de casis (licor de grosella negra) y champán o vino espumoso. Se trata de una variante del cóctel Kir, a base de crema de casis y vino de Borgoña blanco seco, donde el vino blanco es sustituido por champán.###Root -> Categoría:Bebidas_destiladas -> Categoría:Licores -> Categoría:Cócteles con licor",Kir Royale
Kirschwasser,"El kirschwasser (pronunciación en alemán: /ˈkɪʁʃvasɐ/ «agua de cereza») o simplemente kirsch («cereza») es un licor incoloro elaborado por destilación del jugo de una especie de cerezas de Morelo, una variante de la cereza ácida o silvestre, producidas en la Selva Negra de Alemania. Para su elaboración, previamente se ha machacado íntegramente la cereza, incluyendo la cáscara, pulpa y carozo. Es un licor de muy alta graduación alcohólica. Se bebe helado en copa de coñac, o vaso pequeño, y es muy indicado para elaborar diversos cócteles. En ciertas regiones también se sirve a temperatura ambiente y se calienta con las manos, como el brandy. Es un clásico para las fondues de queso. Este licor es muy popular en las regiones francesas de Alsacia, Franco Condado y Lorena, y en Alemania, Austria y Suiza.###Root -> Categoría:Bebidas_destiladas",Kirsch
Kizlyarka,"Kizlyarka (en ruso Кизлярка) — vodka de uva producido en la ciudad de Kizlyar, Daguestán. Alcohol — 40-45 %. Se produce una bebida en la Fábrica de Coñac Kizlyar.###Root -> Categoría:Bebidas_destiladas"
Knockando,"Knockando es una destilería de whisky escocés de malta situada en la población de Knockando en el condado de Moray, Escocia, y dentro de la región del whisky de Speyside. Esta destilería fue construida por John Tytler Thomson en 1898, y lleva el nombre de la población en la que se encuentra. El nombre deriva del gaélico escocés: Cnoc an Dhub, que significa ""el cerro negro"". En 1904 la destilería fue comprada por W & A Gilbey, un productor de ginebra de Londres, pasando a formar parte de J&B / Grand Metropolitan en los años 1960/1970, y ahora es propiedad de la multinacional Diageo.  Knockando fue la primera destilería en Escocia dotada de iluminación eléctrica. En 1905 se conectó directamente con el Great North of Scotland Railway, que unía Grantown-on-Spey con las principales ciudades del noreste de Escocia. También se construyeron casas para los trabajadores de la destilería en las inmediaciones de esta, así como una casa para el Oficial de Aduanas e Impuestos Especiales. La destilería se encuentra actualmente cerca de la estación abandonada de Tamdhu, muy cerca del comienzo de la ruta de Speyside. La vía del tren hace tiempo que ha sido desmantelada. Knockando es el origen de una famosa selección de barricas que entró en la composición del J&B Ultima fabricado en 1994 para celebrar el quinto centenario del whisky escocés. La mezcla contiene 128 whiskies diferentes (116 de malta y 12 de grano) y un tonel de cada uno de estos whiskies todavía está madurando en la bodega.###Root -> Categoría:Bebidas_destiladas -> Categoría:Whisky"
Korn,"Korn es una bebida destilada incolora alemana fabricada a partir de centeno, pero también de maíz, cebada o trigo.[1]​ Difiere del vodka en que su filtrado no es tan riguroso, lo que deja mayor gusto a cereal en el producto final. La bebida es de las más económicas entre los licores disponibles en Alemania, lo que le ha dado una dudosa reputación. Sin embargo es muy popular, especialmente en Alemania del norte. El korn tradicional contiene aproximadament un 32% de graduación alcohólica, el kornbrand no menos de 37,5% y el popular Doppelkorn[2]​ al menos 38%. Una versión suave, con menos de 30% de alcohol puede incluir una mezcla de esencias frutales. Algunas marcas conocidas de korn son Berentzen, Doornkaat, Fürst Bismarck, Mackenstedter, Nordhäuser, Oldesloer, y Strothmann.###Root -> Categoría:Bebidas_destiladas"
Kräuterlikör,"Un kräuterlikör (pronunciación en alemán: /ˈkʀɔɪtɐlikøːɐ/) se refiere a los licores de hierbas de origen germánico, que consisten en hierbas y especias infusionadas en aguardiente y se consideran digestivos. A diferencia de los bíters, los kräuterlikör tienen un contenido de azúcar más alto (azúcar invertido).[1]​ Los licores de este tipo pueden contener desde 15º hasta 44º de graduación alcohólica. Las recetas de kräuterlikör se remontan a autores medievales como Hildegarda de Bingen. En esa época, se usaban mezclas de alcohol y sustancias amargas como medicina para aumentar la secreción de ácido biliar y gástrico. No obstante, una alta cantidad de azúcar y graduación de alcohol puede resultar contraproducente, ya que no favorece la digestión. Hoy en día, los kräuterlikör también se sirve como ingrediente de diferentes cócteles y tragos largos. Reconocidas licorerías fabricantes de kräuterlikör son el Bálsamo Negro de Riga, el Jägermeister, Killepitsch, Kuemmerling, Schierker Feuerstein, Schwartzhog, Wurzelpeter Underberg (en Alemania) y Altvater (en Austria).   == Referencias ==###Root -> Categoría:Bebidas_destiladas -> Categoría:Licores -> Categoría:Licores de hierbas",Krauterlikor
Kümmel,"Kümmel (ortografía alternativa kuemmel) es un licor dulce y transparente condimentado con comino, hinojo y semillas de alcaravea (Kümmel). Para los holandeses, el kümmel se inventó en Holanda, donde se destiló primero, a finales del siglo XVI por Erven Lucas Bols. Posteriormente sería conocido en Rusia, actualmente primer productor y consumidor de kümmel. El destiladísimo Gilka Kümmel (berlinés) tiene un gusto más suave que los kummeles rusos, haciéndolo el estándar de calidad decimonónico.###Root -> Categoría:Bebidas_destiladas -> Categoría:Licores -> Categoría:Licores de hierbas",Kummel
Lacrimae Christi,"Lacrimae Christi (en latín, lágrimas de Cristo) es un tipo de vino propio de la denominación de origen Málaga de color caoba muy intenso que se elabora a base de mosto procedente de uvas sin presión mecánica y se envejece durante un periodo superior a dos años. Los vinos elaborados de la misma manera pero más jóvenes se denominan vino de lágrima.[1]​ Asimismo, también se comercializa con este nombre un vino de la región italiana de Campania, con denominación de origen Vesubio.   == Referencias ==###Root -> Categoría:Bebidas_destiladas -> Categoría:Vinos generosos -> Categoría:Málaga (vino)",Lacrima Christi
Lao-lao,"Lao-lao (o whisky de arroz) (en idioma lao ເຫລົ້າລາວ) es una bebida alcohólica tradicional de Laos, consiste en un licor producido a partir de la fermentación del arroz con alta graduación alcohólica (alrededor del 40%), el cual se produce de manera artesanal en los hogares laosianos. Comúnmente se sirve para dar la bienvenida a los visitantes y en las celebraciones. El vaso en el que se sirve la bebida es uno solo para los comensales que se sientan en círculo y se va rellenando el vaso conforme cada miembro del círculo va tomando la bebida. También es frecuente que en el interior de las botellas de vidrio de Lao-lao se coloquen algunas raíces o reptiles como serpientes o escorpiones, logrando una bebida muy apreciada a la cual se atribuyen propiedades medicinales.[1]​[2]​ También está considerada como la bebida alcohólica más barata del mundo, ya que en su país de origen, se pueden encontrar botellas de este licor a un precio que no rebasa un dólar.[3]​ Junto con el beerlao, que es la cerveza tradicional laosiana, son estas 2 las bebidas alcohólicas más importantes del país asiático.###Root -> Categoría:Bebidas_destiladas",Lao lao,Whisky de arroz
Leche de pantera,"La Leche de pantera es un cóctel muy popular en España de los años setenta. Consta de forma genérica en una mezcla de leche y ginebra.[1]​ Puede ser elaborado con leche condensada y ginebra. Otras variantes contienen leche, ginebra (dos partes de leche condensada por una de ginebra), clara de huevo y canela.[2]​ Fue popular como bebida de la Legión Española que se servía en los bares y mesones donde asistían.[3]​ Una característica que se repite en todas sus variantes es que se sirve fría, y a veces con hielo picado. Si se le añade jarabe de fresa o granadina se denomina Pantera Rosa.###Root -> Categoría:Bebidas_destiladas -> Categoría:Ginebra (bebida) -> Categoría:Cócteles con gin"
Legui,"Legui es un licor fino argentino extraído de la caña de azúcar, elaborado con una infusión de hierbas aromáticas, caramelo y cítricos, con un gran aporte de mandarinas, y se macera en el alcohol. Se obtiene a partir de alcohol de melaza de caña de azúcar. Su nombre se desprende del destacado jockey uruguayo Irineo Leguisamo; de extensa trayectoria obtuvo 32 premios internacionales. Es un aperitivo presentado en botellas de vidrio de 750 ml, la graduación alcohólica es de 29,9°. La caña Legui fue originalmente producida por Orandi y Massera. Actualmente es elaborado por la empresa Grupo Peñaflor en Godoy Cruz, provincia de Mendoza.[1]​[2]​   == Referencias ==###Root -> Categoría:Bebidas_destiladas -> Categoría:Licores"
Lemond,"Lemond es el nombre de un licor de origen checo, que se produce en la ciudad de Karlovy Vary por Karlovarská Becherovka, a.s. Tiene un sabor de limón (incluye ácido cítrico) con el aroma de Becherovka en que está basado. Se consume solo. Junto con Becherovka original es común en el mercado checo, al contrario del Aperitiv KV 14 o licor Cordial.[1]​   == Referencias ==###Root -> Categoría:Bebidas_destiladas -> Categoría:Licores -> Categoría:Bíteres"
Lemon Drop,"Lemon Drop es un cóctel a base de vodka con el sabor dulce y agrio del limón, que se prepara usando jugo de limón, licor triple seco y jarabe simple.[1]​[2]​  Se le describe como una variante o una versión del Martini.[3]​ Por lo general se prepara y se sirve frío con hielo y colado  La bebida fue inventada en algún momento en los 70s por Norman Jay Hobday, el fundador y propietario de Henry Africa's bar en San Francisco, California. Existen algunas variaciones de la bebida, como Lemon Drops de mora azul y frambuesa. Se sirve en algunos bares y restaurantes en los Estados Unidos, y en otras áreas del mundo.[3]​###Root -> Categoría:Bebidas_destiladas -> Categoría:Vodka -> Categoría:Cócteles con vodka"
