Punsch,"El punsch es un licor dulce basado en arak. El punsch es un licor sueco tradicional con orígenes en la India. Su nombre puede provenir de la palabra pantch o pantj en idioma hindú, que quiere decir cinco, y se refiere a los cinco ingredientes que originalmente tenía el licor: arak, azúcar, jugo de limón, agua y té. Su origen en Suecia se remonta al siglo XVIII, alrededor de 1730, cuando se comenzó a importar arac desde la isla de Java, iniciándose su consumo en los restaurantes mezclado con los otros ingredientes ya nombrados, los que el cliente podía elegir. El punsch se sirve caliente (40 °C) junto con un plato también tradicional, la sopa de guisantes sueca (ärtsoppa). También se bebe muy frío después de las comidas o acompañando un café. Se sirve en una pequeña taza de vidrio con asa. Su contenido alcohólico es de 26 % y contiene un 30% de azúcar. Puede tener el mismo origen que el llamado ponche (punch) en Gran Bretaña.###Root -> Categoría:Bebidas_destiladas -> Categoría:Licores"
Queimada,"La queimada es  una bebida alcohólica de la tradición gallega y propia de su gastronomía.    Se le atribuyen facultades curativas y se afirma que, tomada tras la pronunciación del conjuro, funciona como protección contra maleficios, además de mantener a los espíritus y demás seres malvados alejados del que la ha bebido.[1]​[2]​###Root -> Categoría:Bebidas_destiladas -> Categoría:Licores -> Categoría:Licores de España",Conxuro da Queimada
Quina,La Quina es un vino de Jerez.###Root -> Categoría:Bebidas_destiladas -> Categoría:Vinos generosos -> Categoría:Jerez
Rakia,"Rakia o rakija es un destilado similar al brandy, obtenido por destilación del mosto proveniente  de  frutas fermentadas, tradicional en la región de los Balcanes y muy popularizado en países como Serbia, Bulgaria, Eslovaquia, Chequia o Hungría. El contenido en alcohol depende del tipo de destilación, siendo alrededor de 50-53 % en marcas comerciales, pudiendo encontrarse hasta más de 60 % en el producido en pequeñas destilerías. En los países de antigua Yugoslavia existe un tipo especial de rakia, realizado mediante doble destilación, conocido como prepečenica, que suele tener más de un 60 % de contenido alcohólico. El rakia es considerada la bebida nacional de Serbia, Macedonia del Norte, Albania, Bosnia y Bulgaria. El slivovitz es el rakia más habitual, obtenido a partir de ciruelas. Otras frutas de las que puede destilarse rakia incluyen: melocotón, pera, albaricoque, manzana, higo o membrillo. En la región croata de Istria, el rakia se hace exclusivamente a partir de uvas, y es conocida popularmente con el nombre de grappa o trapa (el primer nombre también usado en Italia).  El rakia es un elemento de mayor importancia en la cultura de Serbia, que es el principal país productor de esta bebida. Serbia destina un 80 % de sus ciruelas cosechadas para la elaboración de šljivovica, y es costumbre en este país que al nacer un niño se entierre una botella de Rakia para dejarla madurando por años, que posteriormente es desenterrada y abierta en el día de su boda.[1]​  Los rakia pueden mezclarse después de su destilación con otros ingredientes como miel, cerezas amargas, nueces o distintas hierbas aromáticas.###Root -> Categoría:Bebidas_destiladas",Rakija
Rakı,"Rakı (o Raki) (en turco, Rakı /ɾaˈkɯ/ ( escuchar), en turco otomano ""راقى"" [ɾaˈkɯ]) es un licor anisado célebre en Turquía[1]​, pero en el extranjero aparece a menudo como raki. Es similar a varias bebidas alcohólicas que se pueden encontrar en el Mediterráneo y zonas de los Balcanes como: anís, pastis, sambuca, arak, ouzo, tsikoudia, tsipouro y mastika. Elaborado a partir de varias frutas, pero por lo general se emplean uvas y uvas pasas en su producción.###Root -> Categoría:Bebidas_destiladas -> Categoría:Licores",Raki
Ratafía,"La ratafía es un licor dulce, elaborado a partir de la maceración de distintos frutos[1]​ (nuez verde, cáscara de limón, guindas, clavel rojo), hierbas (menta) y especias (clavos de olor, nuez moscada, canela, rama de zarza) en un alcohol de base, generalmente aguardiente. Según el método y costumbres de la zona geográfica donde se elabore, la composición varía considerablemente.###Root -> Categoría:Bebidas_destiladas -> Categoría:Licores -> Categoría:Licores de España",Ratafia
Red lion,"El Red lion es un cóctel que se caracteriza por su combinación de licor Grand Marnier y frutos cítricos, que aportan a los cócteles más o menos amargura. Los cítricos se suelen utilizar en la preparación de cócteles porque contrarrestan la dulzura que aportan generalmente los licores. Para cualquier cóctel cítrico es muy recomendable utilizar frutas naturales.###Root -> Categoría:Bebidas_destiladas -> Categoría:Ginebra (bebida) -> Categoría:Cócteles con gin",Red lion (cóctel)
Ron agrícola,"El ron agrícola, llamado en francés rhum agricole (pronunciación en francés: /ʁɔm aɡʁikɔl/  escuchar) es un término proveniente de las Antillas francesas que se refiere a aquellos rones que han sido producidos a partir del jugo de la caña de azúcar, y se distingue del ron industrial o rhum industriel, que es aquel ron producido a partir de la melaza de la caña de azúcar. Esta distinción tiene su origen en la Revolución Industrial del siglo XIX, cuando muchas empresas azucareras de Martinica cambiaron sus formas de producción para abaratar los costes, pasando de usar el jugo a la melaza. El poco ron que se siguió produciendo mediante las formas tradicionales de producción se pasó a denominar «ron agrícola».[1]​  El ron agrícola se produce exclusivamente con jugo fresco de caña, que, a diferencia de la melaza, se oxida rápidamente, por lo que las destilerías se encuentran en zonas aledañas a los campos de cultivo.[2]​  Es la variedad más común de ron en Guadalupe, Guayana Francesa y Martinica, pero también se encuentra en las islas Mascareñas del Índico (Mauricio y La Reunión), Haití y la Polinesia Francesa. Sin embargo, el único ron agrícola que cuenta con una denominación de origen (AOC) es el producido en Martinica.[3]​ En la isla portuguesa de Madeira también se produce ron agrícola, llamado aguardiente de cana.[4]​   == Referencias ==###Root -> Categoría:Bebidas_destiladas -> Categoría:Rones",Rhum agricole
Ron Arehucas,"Ron Arehucas es una marca de ron que es fabricada en el municipio de Arucas, Gran Canaria con caña de azúcar.[1]​ La marca fue establecida en 1884 y el 23 de febrero de 1885 salió al mercado.[2]​###Root -> Categoría:Bebidas_destiladas -> Categoría:Rones -> Categoría:Marcas de ron"
Ron Cacique,"Ron Cacique es una marca comercial de ron venezolano creada por los fundadores de Licorerías Unidas. Cacique es actualmente propiedad de la empresa de licores Diageo, quien la distribuye en Venezuela, España, Chile, Ecuador, México e Italia. A finales de los años 50 Licorerías Unidas, una empresa fundada por Gustavo Vegas León e hijos (Sucesores de Don Tomás Sarmiento), quienes luego asociados con las distribuidoras Benedetti, Chumaceiro y Morris E. Curiel y junto con la canadiense Seagram’s Company, comienzan a envejecer un ron ligero en la Hacienda Saruro en La Miel, Estado Lara al occidente de Venezuela. La diferencia fundamental entre el nuevo producto y el resto de los rones producidos en el Caribe radicaba en la maduración del ron, en el primero el proceso se realiza en dos años y en el resto el tiempo aproximado es de seis meses. La empresa comienza a producir su ron con sus plantaciones de caña y reservas de agua mineral propias. Así en diciembre de 1961 la compañía Licorerías Unidas lanza al mercado venezolano el ron Cacique que se produce a partir de la fase de destilación de donde se obtienen siete tipos de rones y que luego combinados crean el ron Cacique. También, como para todos los rones venezolanos está prohibido en Venezuela cambiar la mezcla del ron para cambiar el color, sabor y aroma de manera artificial. La Seagram’s Company, que era accionista mayoritaria de Licorerías Unidas desde 1959, decide adquirir la totalidad de las acciones de la empresa venezolana en 1992, año en que la crisis económica y política de Venezuela había llegado a los niveles más elevados, y que a consecuencia de ello había reducido la capacidad de consumo del consumidor. Además de la crisis de la época el segmento de rones en Venezuela debía enfrentar la competencia en el mercado del whisky importado y de otras bebidas alcohólicas que comenzaban a crecer en el mercado, por ello se optó por buscar otras fuentes de ingresos y se decide exportar el producto a España y algunos países de Latinoamérica. Ese mismo año en conmemoración a la llegada de los españoles a América se lanza al mercado la edición Cacique 500 Años. En 2001 Seagram Venezuela es adquirida por Diageo, pasando a comercializar todas sus marcas, entre ellas Cacique. Un año después Cacique se convierte en la marca líder del mercado venezolano desplazando a su principal competidor Ron Santa Teresa.[1]​###Root -> Categoría:Bebidas_destiladas -> Categoría:Rones -> Categoría:Marcas de ron",Cacique (ron)
Ron de ponsigué,"El ron con ponsigué es una bebida alcohólica originada en Venezuela y preparada a partir de la maceración del ponsigué, una fruta similar a la cereza propia de climas tropicales con un sabor ácido, en recipientes de ron o aguardiente de caña. Concretamente la bebida es tradicional del oriente venezolano, y es de espíritu celebratorio, tendiéndose su consumo para después de las misa de aguinaldo o las fiestas populares.[1]​ Al momento de su preparación, se suelen macerar los frutos en un frasco de ron blanco con un clavo de olor, azúcar, canela y nuez moscada, dejándose reposar por espacio de un mes a un año,[2]​ al término del cual debe tener un color más oscuro.###Root -> Categoría:Bebidas_destiladas -> Categoría:Rones"
Ron de Venezuela,"Ron de Venezuela es una denominación de origen controlada otorgada por el SAPI desde el año 2003 a los principales rones de Venezuela que cumplen con los requisitos de tener en el total de sus componentes rones de un mínimo de dos años de envejecimiento en barrica de roble blanco y 40 grados de alcohol anhidro. En el 2014 Venezuela fue reconocida mundialmente con los galardones de mejor ron del mundo y mejor destilería del mundo en el Concurso Internacional de Cata celebrado en Madrid, España.###Root -> Categoría:Bebidas_destiladas -> Categoría:Rones",Ron de venezuela
Ron,"El ron es una bebida alcohólica, elaborada a partir de la fermentación y destilación de la melaza o el jugo de la caña de azúcar. La mayoría de su producción se encuentra en las Américas, y concretamente el Caribe, aunque también se da en otros países como las Filipinas o la India.[1]​  Tras fermentarse, el producto es destilado a altas temperaturas usando alambiques de cobre o de acero inoxidable para obtener un alto contenido de etanol. El destilado resultante es diluido entonces con agua pura desmineralizada hasta alcanzar una concentración de etanol de entre el 35 y 40%. Posteriormente, de forma opcional, es sometido a procesos de añejamiento, generalmente en barricas de roble.[2]​  Esta bebida se menciona por primera vez en documentos provenientes de Barbados en 1650. Se le llamaba kill-devil o rumbullion (una palabra de Devonshire, Inglaterra, que significa 'un gran tumulto').[3]​ En las colonias antillanas francesas, se le llamó guildive (modificación de kill-devil) y posteriormente tafia, un término probablemente africano o indígena. Ya en 1667 se le llamaba simplemente rum. La primera mención oficial de la palabra rum aparece en una orden emitida por el Gobernador General de Jamaica con fecha del 8 de julio de 1661.[4]​###Root -> Categoría:Bebidas_destiladas",Ron añejo,Ron blanco,Ron añejado,Ron ligero,Ron plateado,Ron dorado,Ron ámbar,Ron dulce,Licor de ron,Ron escarchado
Ron La Hechicera,"Ron La Hechicera es un ron premium producido en Barranquilla, Colombia, desde 2012[1]​ La Hechicera es producido bajo la dirección de los hermanos Laura y Miguel Riascos. Fue lanzado en Londres en noviembre del 2012. En 2013, la revista GQ versión Reino Unido incluyó La Hechicera como una de las ""100 mejores cosas del mundo en este momento"".[2]​###Root -> Categoría:Bebidas_destiladas -> Categoría:Rones -> Categoría:Marcas de ron"
Ron miel,"El ron miel (o ronmiel) es una variedad de ron, elaborado a partir de aguardiente de caña o melaza, típico de las Islas Canarias. Se conoce como ron miel, debido a que el producto final incorpora una cantidad de miel de abeja superior al 2 % del volumen total. Su graduación alcohólica va del 20 al 30 %. Es de sabor intenso y dulce, y su color va del oro viejo al caoba intenso. En 2005 la Consejería de Agricultura del Gobierno de Canarias creó una Denominación Geográfica específica para el ron miel bajo el nombre Ronmiel de Canarias.[1]​   == Referencias ==###Root -> Categoría:Bebidas_destiladas -> Categoría:Rones",Ron Miel,Ronmiel
Ron Santa Teresa,"Ron Santa Teresa[1]​[2]​[3]​ (IBC: RST Archivado el 20 de marzo de 2018 en Wayback Machine.) es una marca productora de ron[4]​ de Venezuela.[5]​[6]​[7]​ Es la primera de Venezuela,[8]​[9]​[10]​ con más de 200 años de tradición en la fabricación de rones añejos. Actualmente presidida por el empresario venezolano Alberto C. Vollmer,[11]​[12]​ quien pertenece a la quinta generación de la familia dedicada a la producción de rones en Venezuela.[13]​ La marca Ron Santa Teresa es conocida por sus productos, sus proyectos sociales[14]​ a través de la Fundación Santa Teresa (Proyecto Alcatraz, Rugby Santa Teresa y Proyecto Casas Blancas). La sede de la empresa se encuentra en la Hacienda Santa Teresa,[15]​ fundada en 1796 por el Conde Martín Tovar Ponte,[16]​ donde en la actualidad existe un complejo agroindustrial, turístico y deportivo.###Root -> Categoría:Bebidas_destiladas -> Categoría:Rones -> Categoría:Marcas de ron"
Ron Zacapa Centenario,"Ron Zacapa Centenario es un ron premium producido en Guatemala[1]​ por Rum Creation and Products, filial de Industrias Licoreras de Guatemala, y distribuido y comercializado por Diageo. El Ron Zacapa Centenario fue creado en 1976 para celebrar el centenario de Zacapa, una ciudad del oriente de Guatemala. Se produce con el jugo concentrado del primer prensado de la caña de azúcar, llamado ""miel de caña virgen"", y se añeja y mezcla usando el método de la solera, tradicionalmente usado para jerez. Este proceso es vigilado por la master blender Lorena Vázquez. La compañía manifiesta que parte de su éxito reside en el hecho de que los barriles se almacenan a 2300 msnm en unas instalaciones de añejamiento ubicadas debajo de las faldas superiores de las montañas y volcanes de Guatemala, donde la temperatura, en promedio, es de 62 grados Fahrenheit (16,7 °C).[2]​ Las primeras botellas de Zacapa venían cubiertas de un petate[3]​ - una estera tejida a mano que se hace de hojas de palma que data del periodo maya. Más recientemente, presentan una banda alrededor de la mitad de la botella.[2]​ Zacapa ha ganado premios en diferentes competencias internacionales y es el primer ron en ser incluido en el International Rum Festival's Hall of Fame.[4]​ El Beverage Testing Institute le ha dado a Zacapa una nota de 95 puntos.[5]​###Root -> Categoría:Bebidas_destiladas -> Categoría:Rones -> Categoría:Marcas de ron"
Russian Standard,"Russian Standard (En Ruso: Русский стандарт, Russkiy Standart) Vodka es una empresa rusa productora de vodka.  El vodka Russian Standard domina el segmento premium de mercado en Rusia con una cuota del 60% y con 2,1 millones de ventas en Rusia en 2008 y más de 60 en exportaciones a los mercados de Europa, EE. UU. y Asia. Roustam Tariko, el fundador de Russian Standard, presentó Russian Standard Original en 1998 como el auténtico primer vodka premium ruso. El vodka Russian Standard es elaborado sólo con los ingredientes rusos más selectos, conformándose la fórmula para el vodka creado en 1894 por el célebre científico ruso Dmitri Mendeléyev para los Zares de Rusia. Dos años después del lanzamiento, las ventas de Russian Standard Original sobrepasaron a todos los vodkas premium de importación del mercado ruso, conduciendo así a la amplia extensión internacional y el lanzamiento de Russian Standard Platinum en 2001, Vodka IMPERIA, la gama de lujo de la empresa, en 2004 y el Russian Standard Gold en 2008.[1]​###Root -> Categoría:Bebidas_destiladas -> Categoría:Vodka -> Categoría:Marcas de vodka"
Rusty Nail,"Un Rusty Nail («clavo oxidado») es un cóctel elaborado con Drambuie y whisky escocés. La bebida se incluyó en los 100 mejores cócteles de la Guía de Difford.[1]​ Un Rusty Nail se puede servir en las rocas o neat en un vaso old fashioned, o up en un vaso martini. Lo más común es servirlo con hielo; a veces, un Rusty Nail sin hielo se llama Straight Up Nail.###Root -> Categoría:Bebidas_destiladas -> Categoría:Licores -> Categoría:Cócteles con licor"
Saltamontes,"El Saltamontes o en inglés, Grasshopper (/ˈgræsˌhɑpɚ/; lit. «saltacésped»), es un cóctel de crema de menta, crema de cacao y crema de leche originario de Estados Unidos, donde tradicionalmente se sirve tras la cena. El nombre de la bebida deriva de su color verde, que proviene de la crema de menta. Tiene un sabor dulce y mentolado. Un bar en el Barrio francés de Nueva Orleans, Luisiana, Tujague's, afirma que la bebida fue inventada en 1918 por su propietario, el abuelo de Cathy.[1]​ La bebida ganó popularidad durante las décadas de 1950 y 1960 en todo el sur de Estados Unidos.###Root -> Categoría:Bebidas_destiladas -> Categoría:Licores -> Categoría:Cócteles con licor",Grasshopper (cóctel)
Sambuca,"La Sambuca es un licor dulce y fuerte basado en el anís,  típico de Italia y más concretamente de Lacio.[1]​ La “sambuca” también recibe el cariñoso  diminutivo de “sambuchina”.  La legislación comunitaria lo regula otorgándole una “denominación de venta”.[2]​ Entre los requisitos exigidos para que este licor pueda ser expedido como “sambuca” se exige que esté hecho con anís, tanto verde como estrellado, e incluso con otras hierbas aromáticas; pero no se exige la presencia de saúco en el licor.  “Sambuco” significa “saúco”; es decir, el arbusto conocido como Sambucus nigra L. Según Zingarelli, etimológicamente el licor llamado “sambuca” deriva de “sambuco” en el sentido de saúco,[3]​ el mencionado Sambucus nigra L. Emmanuel & Madelene Greenberg  lo describen como un licor aromatizado con saúco.[4]​ Tales afirmaciones plantean el problema de explicar cómo es posible que, en un licor de saúco,  el saúco pueda estar ausente.  De hecho, no lo contiene. No parece que el saúco sea muy necesario para el resultado del licor. Se ha propuesto otra etimología. Gordon Brown, aunque no es filólogo, sino especialista en bebidas alcohólicas, ha propuesto que deriva etimológicamente de “zambur”, que a su vez deriva de “zummu”.[5]​  Se  trataría de una bebida de origen árabe, proveniente de su influencia tras la conquista de Sicilia. Nadie, en cambio, le ha atribuido provenir de la embarcación llamada “sambuco”, ni de la máquina de guerra llamada “sambuca”. Marcas conocidas son Ramazzoti, Molinari, Romana y Vaccari. El modo más típico de servirlo es flamearlo en presencia de granos de café, con mosca, como si se hubiesen caído y ahogado algunas moscas en la infusión de café. Si se toma sin flambear, el café no llega a impregnar el líquido. Por ello también existen sambucas que ya contienen la infusión de café. Opal Nera es una marca muy conocida de esta clase de sambuca. Un resultado muy parecido se consigue echando un poco de café a la sambuca. El fruto del saúco —unas bolitas negras, con fama de ser buenas para el reuma—  tiene bastante parecido con los granos de café. Quizá el café acabó sustituyendo el saúco. Se explicaría así la conexión de la sambuca con el saúco. Pero habría que demostrarlo.###Root -> Categoría:Bebidas_destiladas -> Categoría:Licores -> Categoría:Licores de Italia"
Scotch Whisky Association,"La Scotch Whisky Association (SWA) es la asociación reguladora de la denominación «Scotch Whisky», un sector que corresponde al alrededor del 85 % de las exportaciones de alimentos y bebidas de Escocia y casi un 25 % de las del Reino Unido.[1]​ Se dedicada asimismo a proteger la marca en el contexto de la indicación geográfica protegida (IGP), según la normativa EC Regulation 110/2008 de la Unión Europea sobre bebidas alcohólicas, y la ley británica Scotch Whisky Regulations 2009.[2]​ Sus miembros abarcan más del 90 % de la producción del sector.[3]​###Root -> Categoría:Bebidas_destiladas -> Categoría:Whisky"
Serena libre,"El Serena libre o serena sour es un cóctel preparado con pisco chileno y jugo de papaya. Fue creado durante los años 1990 en los bares de La Serena, Chile, mezclando el zumo de papaya, fruto muy cultivado en la zona de la Región de Coquimbo y símbolo de la ciudad, con el pisco, principal licor producido en la zona.[1]​ Es de fácil preparación, pues contiene: 2 medidas de pisco chileno, jugo de papaya, azúcar flor a gusto y hielo, ingredientes que se baten y agitan.###Root -> Categoría:Bebidas_destiladas -> Categoría:Pisco -> Categoría:Cócteles con pisco",Serena Libre,Serena sour
Sex on the Beach,"Sex on the Beach (Sexo en la Playa) es un cóctel con múltiples variaciones. Hay dos tipos en general:  El primero se hace a base de vodka, licor de melocotón, zumo de naranja y zumo de arándanos. Este es el cocktail oficial de la International Bartenders Association.El segundo está hecho a base de vodka, Chambord, Midori, zumo de piña y zumo de arándanos. Se creó en el restaurante TGI Friday's y está incluido en la Mr. Boston Official Bartender's Guide (Guía Oficial Mr. Boston para bármanes).[1]​Otra versión, llamada Noe on the beach, añade Tequila a la combinación. Es habitual en la península ibérica. Los ingredientes se mezclan con hielo en una coctelera y se sirven en un vaso Highball. En ocasiones puede servirse en pequeñas cantidades como un chupito.###Root -> Categoría:Bebidas_destiladas -> Categoría:Vodka -> Categoría:Cócteles con vodka",Sexo en la Playa,Sex on the beach,Sexo en la playa
Sierras de Málaga,"La Denominación de Origen Sierras de Málaga es una indicación geográfica protegida para la variedad de vino cultivada en la provincia de Málaga, España, que se ajuste a los requisitos establecidos por su consejo regulador.  La DO Sierras de Málaga fue creada en 2001 y ampara vinos blancos, rosados y tintos de menos de 15% vol. El mismo consejo regulador también regula la Denominación de Origen Pasas de Málaga y la Denominación de Origen Málaga.###Root -> Categoría:Bebidas_destiladas -> Categoría:Vinos generosos -> Categoría:Málaga (vino)",Denominación de Origen Sierras de Málaga,Sierras de Malaga,Denominacion de Origen Sierras de Malaga,Denominación de Origen Sierras de Malaga,Denominacion de Origen Sierras de Málaga
Siglo XX,"El Siglo XX, originalmente en inglés, 20th Century, es un cóctel creado en 1937 por un barman británico llamado C.A. Tuck, y nombrado en honor del famoso tren Twentieth Century Limited que estuvo en funcionamiento entre las ciudades de Nueva York y Chicago desde 1902 hasta 1967. La receta fue registrada por escrito por primera vez en 1937 en el Café Royal Cocktail Book de William J Tarling, presidente del Gremio de Bartenders del Reino Unido, y jefe de camareros en el Café Royal.[1]​###Root -> Categoría:Bebidas_destiladas -> Categoría:Ginebra (bebida) -> Categoría:Cócteles con gin"
Singani,"Singani es una bebida alcohólica boliviana, con denominación de origen protegida, de la familia del aguardiente de uvas. Se elabora a partir de la destilación de vino de la uva moscatel de Alejandría o Muscat de Alejandría. El singani fue declarado Patrimonio Cultural de Bolivia, mediante la ley 774.[1]​  Es originario de la zona de los valles de los departamentos de Tarija y Chuquisaca (Cinti), siendo el principal ingrediente en muchos cócteles tradicionales bolivianos, como el Chuflay, Poncho Negro y el Yungueñito. Entre las principales marcas de singani, se encuentran: Casa Real, Los Parrales, Rujero, San Pedro Oro, San Remo, San Mateo, Camargo, etc.###Root -> Categoría:Bebidas_destiladas",Singani (bebida),Singani (licor)
Slippery Nipple,"El Slippery Nipple («pezón resbaladizo») es un cóctel de dos capas: la superior de Baileys y la inferior de Sambuca. Cuando se prepara adecuadamente, los ingredientes permanecen en dos capas visiblemente separadas, debido a sus diferentes densidades relativas.###Root -> Categoría:Bebidas_destiladas -> Categoría:Licores -> Categoría:Cócteles con licor",Slippery nipple
