Calisay,"Calisay es un licor estomacal de hierbas aromáticas cuya fórmula parece provenir de un monasterio de Bohemia, posteriormente fabricado en Blanes (la Selva) y a partir de 1896 en Arenys de Mar por la familia Mollfulleda en la fábrica de Calisay, establecido en un antiguo molino de harina del XVI.[1]​ En la década de 1980, la fórmula pasó a manos de Rumasa, que continuó elaborando el licor en Arenys de Mar. A finales de los 80, cuando Rumasa fue expropiada por orden del Ministro de Economía y Hacienda del Gobierno Español, la marca pasó a manos del empresario Pedro Rovira, que en trasladó la producción a Mora la Nueva . Desde principios del XXI la marca pertenece a las «Bodegas Garvey»,[2]​dentro del grupo madrileño grupo Emperador. En plena decadencia de la industria licorera catalana, el edificio Calisay ha pasado a titularidad municipal y el ayuntamiento de Arenys de Mar la ha reconvertido en un centro cultural. En la actualidad (2021) las botellas históricas de Calisay y los licores Mollfulleda en general son objetos de colección. Entre los coleccionistas es especialmente valorada la petaca de tapón de corcho, de la que se conservan muy pocos ejemplares.###Root -> Categoría:Bebidas_destiladas -> Categoría:Licores"
Calvados,"El calvados es un aguardiente con Appellation d'origine contrôlée o AOC (Denominación de Origen Controlada), que se obtiene por destilación de la sidra y es producido exclusivamente en la región de Normandía, Francia.###Root -> Categoría:Bebidas_destiladas",Calvados (licor)
Campari,"Campari es una bebida alcohólica de grado medio, tonificante y refrescante, calificable como aperitivo, de característico color rojo y sabor amargo. La marca es propiedad del Grupo Campari. En España y parte del mundo de habla en español se le conoce con el nombre de bitters o bíters (los bitters o bíters son una elaboración que se usa para aromatizar los cócteles, siendo el amargo de Angostura uno de los más conocidos y que se compra ya preparado. Los orígenes de los bitters se remontan a los antiguos egipcios, ya que infusionaban hierbas medicinales en jarras de vino, la marca más conocida es Cinzano Aperitivo Bitter Soda, Cinzano es una marca italiana de vermú, propiedad del Grupo Campari.)###Root -> Categoría:Bebidas_destiladas -> Categoría:Licores -> Categoría:Bíteres"
Canadian Club,"Canadian Club es una marca de whisky de Canadá, popularmente conocida como C.C. Canadian Club. Fue fundada en 1858 por de Hiram Walker y se conocía como Walker’s Club Whiskey. Actualmente la marca es comercializada por Beam Inc.""###Root -> Categoría:Bebidas_destiladas -> Categoría:Whisky -> Categoría:Marcas de whisky",C.C. Canadian Club,Walker’s Club Whiskey
Caña,"Se denomina caña a varias bebidas alcohólicas obtenidas a partir de destilados alcohólicos simples o de la destilación de mostos fermentados de jugos de caña de azúcar o de melazas o de mieles de caña de azúcar. En la definición de caña se comprenden varias bebidas con diferentes nombres. Su popularidad se extiende a lo largo de varias regiones de América Latina, principalmente en Venezuela, Argentina, Perú, Uruguay, Paraguay, Brasil, Ecuador, Veracruz, e incluso España. En Galicia se conoce como “caña” o “augardente” al orujo o aguardiente.###Root -> Categoría:Bebidas_destiladas",Cana (bebida),Caña quemada
Candié,"El candié (del inglés candy, caramelo y egg, huevo) era un reconstituyente propio del Marco de Jerez, en la provincia de Cádiz (España). Su creación está fuertemente ligada a la producción de vinos de Jerez.[1]​ En México suele denominarse ""polla""[2]​###Root -> Categoría:Bebidas_destiladas -> Categoría:Vinos generosos -> Categoría:Jerez"
Cantueso,"El cantueso es un licor elaborado en la provincia de Alicante, España. Especialmente en la Ciudad de Elche, en los últimos tiempos debido a los cambios de crecimiento de este sector. Inicialmente, proviene de un pequeño pueblo de poco más de 12.000 habitantes, denominado Monóvar (Alicante) el cual empezó su elaboración a mediados del 1800, aunque anteriormente se tomaba como infusión. Se obtiene por la destilación de la flor y el pedúnculo de la planta del cantueso y alcohol neutro. Su contenido en alcohol está comprendido entre el 25% y el 35% con un contenido en azúcar de 100 gramos el litro, lo que le proporciona un sabor dulzón característico y un color que va desde el transparente al parduzco. Para su elaboración el licor debe permanecer un mínimo de dos meses en reposo pudiendo ser envejecido en barricas de madera durante un periodo de dos años como mínimo. Su elaboración está regulada por la denominación de origen bebidas espirituosas de Alicante junto con la del anís paloma, el herbero y el café licor.###Root -> Categoría:Bebidas_destiladas -> Categoría:Licores -> Categoría:Licores de España",Cantueso(licor)
Capitán,El capitán es un clásico cóctel peruano a base de pisco.###Root -> Categoría:Bebidas_destiladas -> Categoría:Pisco -> Categoría:Cócteles con pisco
Captain Morgan,"Captain Morgan es una de las marcas de ron producida por la empresa Diageo. Recibe este nombre por el corsario del Caribe del siglo XVII originario de Gales Henry Morgan. El eslogan de Captain Morgan es: ""¿Hay un pequeño capitán en ti?"" («Got a little Captain in You?»).###Root -> Categoría:Bebidas_destiladas -> Categoría:Rones -> Categoría:Marcas de ron"
Carcavelos,"El carcavelos es un vino generoso portugués con denominación de origen controlada (DOC). La producción se realiza en la región demarcada de Carcavelos, que abarca parte de los concelhos de Cascaes y Oeiras, situados al oeste de Lisboa.  Muy protegido durante los tiempos del Marqués de Pombal, que lo producía en su quinta de Oeiras, tiene en la actualidad una producción muy limitada.###Root -> Categoría:Bebidas_destiladas -> Categoría:Vinos generosos"
Cardhu,"Cardhu (roca negra en gaélico) es una destilería de whisky de malta de Speyside situada cerca de Archiestown, Morayshire, Escocia. Fue fundada por el contrabandista de whisky John Cumming en 1824. En el 2010 pertenecía a Diageo, y forma parte del conocido whisky blended Johnnie Walker.###Root -> Categoría:Bebidas_destiladas -> Categoría:Whisky"
Carrulim,"El carrulim (acrónimo de caña, ruda y limón)  o caña con ruda es una tradición enraizada originalmente en el área guaranítica, especialmente en Paraguay y en el nordeste argentino donde se la conoce como «caña con ruda». La creencia dice que, cada 1 de agosto del año, hay que beber tres tragos en ayunas para obtener sus beneficios.[2]​  El 29 de julio de 2019, la Secretaría Nacional de Cultura (SNC Paraguay) decidió:Declarar como Patrimonio Cultural Inmaterial al Carrulim, mezcla de caña, ruda y limón, brebaje tradicional del Paraguay. Sus prácticas sociales inherentes se transmiten de generación en generación y son realizadas cada 1 de agosto para purificar la sangre y atraer la buena suerte, en el ámbito de los conocimientos y usos relacionados con la naturaleza y el universo.”[3]​ La escritora argentina Julia Norma Catalano declara en su libro Caña con ruda: ""Caña con ruda es un remedio ecológico, es un popular sortilegio de este tiempo. Circula como el rumor, seduce porque es el emergente de lo que la gente cree y autojustifica cada uno a su manera"".[4]​###Root -> Categoría:Bebidas_destiladas",Caña con ruda,Caña con ruda (tradición)
Cazalla,"La cazalla es una bebida alcohólica típica valenciana derivada de la destilación del anís. Es por tanto un derivado del anís semiseco.[1]​ Se bebe principalmente en las comarcas de La Safor, La Ribera Baixa y La Vall d' Albaida. Una de las formas populares de tomarla es la 'Paloma Tenis', siendo mezclada con agua fría para hacerla refrescante en verano.  [2]​ El nombre proviene del pueblo andaluz Cazalla de la Sierra.[3]​   == Referencias ==###Root -> Categoría:Bebidas_destiladas"
Cerebrito,"El cerebrito, sesos de mono o cerebro de mono es un chupito elaborado con vodka, jugo de lima, crema irlandesa y granadina. Opcionalmente se puede decorar con nata montada.[1]​ Aunque es poco común, también existen recetas de cerebro de mono en formatos más grandes, como en vaso Old Fashioned o en copa de cóctel.[2]​ Su nombre proviene de la textura que generan la granadina y la crema irlandesa, similar a un cerebro en formol. Suele servirse en los Happy hours durante Halloween.[3]​###Root -> Categoría:Bebidas_destiladas -> Categoría:Vodka -> Categoría:Cócteles con vodka",Sesos de mono (chupito)
César,"Un César o un Caesar es un cóctel creado y consumido principalmente en Canadá. Sus ingredientes principales son el vodka y el Clamato (una mezcla de zumo de tomate y caldo de almejas), salsa picante y salsa inglesa. Se sirve con hielo en un vaso con el borde cubierto de sal de apio. Suele adornarse con un tallo de apio y una rodaja de lima. Fue inventado en Calgary, Alberta en 1969 por Walter Chell para celebrar la apertura de un nuevo restaurante italiano en la ciudad. Rápidamente se convirtió en una bebida muy popular en Canadá, donde se dice que anualmente se consumen más de 350 millones de Césars. Sin embargo, la bebida es prácticamente desconocida fuera del país.###Root -> Categoría:Bebidas_destiladas -> Categoría:Vodka -> Categoría:Cócteles con vodka",Caesar (coctel),César (coctel)
Charanda,"La charanda es una bebida alcohólica regional mexicana, anteriormente denominada aguardiente, típica del estado de Michoacán, obtenida por destilación y rectificación de mostos fermentados, preparados a partir de jugo de caña o de sus derivados, como el melao (jugo concentrado por evaporación), el piloncillo, la melaza o el propio azúcar cristalizado, o bien con subproductos del azúcar refinado, como las mieles incristablizables de los ingenios azucareros aledaños a Uruapan, o producto dañado, por lo cual los ingenios no distribuyen comercialmente el azúcar. Originalmente el producto de la fermentación y posterior doble destilación del aguardiente, pues, es un producto con esencias a caña dulce, incoloro principalmente, que cuando es reposado en barricas de madera de roble o de encino torna a un color ambarino. Su contenido alcohólico varía de 50 % a 55 % por cada 100 mililitros o centímetros cúbicos.[1]​ Este destilado ha existido por lo menos desde 1857. Es una de las razones por las que el nombre purépecha charanda persiste en su lengua materna, que significa «tierra colorada», en honor del cerro La Charanda,[2]​ ubicado  en inmediaciones de Uruapan, en cuya falda se edificó la primera destilería, aprovechando el piloncillo que se produce en la región y el oficio del mejor alambiquero de la zona: Fidel Altamirano Contreras. Se ocupó un edificio fincado por Eduardo Chávez Alba para establecer su fábrica de aguardiente. Su viuda, Soledad de la Peña, en los años 1960 la rentó a Alfonso Figueroa Torres, de prosapia aguardientera, propietario de la fábrica de La perla (establecida en 1917), para continuar la producción del aguardiente de caña marca Charanda, lo cual prevaleció hasta los años 1970, cuando la sucesión de la señora dio por terminada la relación.###Root -> Categoría:Bebidas_destiladas"
Chartreuse,"La Chartreuse es un licor de hierbas de origen francés, elaborado a partir de macerar ciertas hierbas en un aguardiente de alta graduación. El licor se denomina así en honor al monasterio cartujo de la Grande Chartreuse (en castellano: «la Gran Cartuja»), de donde procede, que toma a su vez el nombre del macizo de la Chartreuse (en castellano: «macizo de la Cartuja»), en los Alpes, la región de Francia donde se ubica el monasterio.###Root -> Categoría:Bebidas_destiladas -> Categoría:Licores -> Categoría:Licores de Francia"
Cherry Bounce,"El Cherry Bounce (/'tʃɛri 'baʊns/; algo así como «cereza vigorosa») es un licor hecho al infusionar brandy con cerezas y azúcar. Algunas recetas usan ron, whisky o vodka en lugar de brandy. La aldea inglesa de Frithsden afirma ser el lugar de origen del Cherry Bounce.[2]​ Un carril que conduce a Old High Street en la cercana Hemel Hempstead se llama Cherry Bounce y se muestra que tenía este nombre en mapas que datan de principios del siglo XIX. La bebida, sin embargo, es al menos un siglo mayor. Cherrybounce se registra como el apodo de un individuo anónimo en un informe de la Cámara de los Lores en 1670.[3]​ El licor, que es popular en algunas partes de los Estados Unidos, también tiene una larga historia allí. Se encontró una receta entre los periódicos de Martha Washington.[4]​ Se dice que fue una de las bebidas favoritas de George Washington.###Root -> Categoría:Bebidas_destiladas -> Categoría:Licores -> Categoría:Licores de fruta -> Categoría:Licores y licores de cereza",Cherry bounce
Chilcano,"El chilcano o chilcanito es un cóctel tradicional peruano que se prepara sobre la base del pisco, jugo de limón y refresco de soda.[1]​ Sería una adaptación del «gin con gin».[2]​ Las referencias más antiguas datan de inicios del siglo XX, en el texto Cómo era una jarana en el Cercado allá por el año 1900 escrito por Eudocio Carrera Vergara.[1]​ El trago habría perdido popularidad durante la primera mitad del siglo XX para luego volver a ser popular en la década de 1950.[2]​ Actualmente se ha incrementado su consumo frente a otros cócteles preparados con pisco por la facilidad de su preparación y el bajo costo que implica.[2]​###Root -> Categoría:Bebidas_destiladas -> Categoría:Pisco -> Categoría:Cócteles con pisco",Chilcano de pisco,Chilcano (coctel),Chilcano (cóctel),Chilcanito
Chinchón,"El chinchón es una bebida alcohólica anisada con Indicación Geográfica Protegida. Es producida y embotellada en la localidad de Chinchón, en la Comunidad de Madrid, España.###Root -> Categoría:Bebidas_destiladas -> Categoría:Licores -> Categoría:Licores de España",Chinchon (bebida)
Chirrinche,"El chirrinche[1]​ es una bebida alcohólica proveniente del guarapo, que es el nombre que recibe en los hogares campesinos de las regiones andinas de Colombia una bebida fermentada a partir de la miel de caña o de panela. El chirrinche es una bebida alcohólica utilizada en los rituales tradicionales wayuu y característico del departamento de La Guajira. Aunque también es popular en otros departamentos del altiplano cundiboyacense como Cundinamarca, Boyacá y Bogotá,[2]​ así como en el Caribe colombiano, Cesar, sur del Magdalena y zona central de Bolívar donde particularmente recibe el nombre de ñeque.[3]​###Root -> Categoría:Bebidas_destiladas -> Categoría:Rones"
Chivas Regal,"Chivas Regal es un whisky escocés premium producido por la compañía Chivas Brothers, propiedad del grupo Pernod Ricard, producido en Aberdeen, Escocia, desde 1801. Es un whisky de mezcla, con lo que no se produce en una sola destilería. Tiene en la destilería Strathisla, ubicada en el pequeño pueblo de Keith cercano al río Spey, su localidad de referencia. Chivas Regal es una de las marcas premium de whisky con mayor volumen de ventas a nivel mundial.[1]​ Es una de las marcas de whisky escocés más reconocidas a nivel internacional, siendo exportada a más de 200 países.[2]​ Cada una de las botellas está numerada y el producto es elaborado con agua de manantial.[2]​###Root -> Categoría:Bebidas_destiladas -> Categoría:Whisky -> Categoría:Marcas de whisky"
Chopin,"Chopin vodka El vodka es producido por la empresa Podlaska Wytwórnia Wódek Polmos, con sede en Siedlce. Para cada botella de Chopin se utilizan aproximadamente 4 kilos de patatas. El vodka recibe su nombre del famoso compositor polaco de música romántica Frédéric Chopin.###Root -> Categoría:Bebidas_destiladas -> Categoría:Vodka -> Categoría:Marcas de vodka"
Cinzano,"Cinzano es una marca italiana de vermú, propiedad del Grupo Campari.###Root -> Categoría:Bebidas_destiladas -> Categoría:Licores",Cinzano (vermu)
Clerén,"El Clerén  —conocido también Triculí, Pitrinchi o Tapa Floja—  es una bebida alcohólica de fabricación ilegal originaria de Haití. Se produce usando guarapo, caña de azúcar, frutas fermentadas, raíces de guayacán, corteza de caoba, metanol, e incluso Thinner. También se le agregan desechos de aves, tripas y cabeza de pollo, que en estado de putrefacción generan más rápido el alcohol.[1]​ Su proceso de destilación es similar al del Ron, pero sin refinar.[2]​  Generalmente es consumido por personas de escasos recursos, pues el Clerén es muchísimo más barato que el Ron legal común y corriente. Se fabrica en destilerías clandestinas y traspatios de casuchas de barrios marginados con muy poca higiene y destilado usando herramientas rudimentarias. Se vende al granel y los compradores que quieren tomar, traen sus propios envases, o bien, se envasa en botellas o en recipientes ya usados. En  Haití, el Clerén se prepara en destilerías llamadas Guildives y se bebe en ciertos rituales de vudú.[3]​ El negocio ilegal de esta bebida también se desarrolla en República Dominicana, país al que se introdujo gracias al contrabando en la frontera que divide a ambos países,[4]​ y es fabricado, vendido y consumido en las mismas condiciones, y por el mismo segmento poblacional mencionado líneas arriba. También se vende en colmados. El Gobierno Dominicano ha tomado medidas para evitar la propagación de esta bebida adulterada. Existe una variante dominicana del Clerén,  llamada Berunte, fermentado a partir de maíz (que es el más común), arroz, melón, piña o trigo.###Root -> Categoría:Bebidas_destiladas",Berunte
Cocoroco,"Cocoroco es el nombre que se da en algunas partes del norte de Chile, al etanol introducido en este país por contrabando desde Bolivia.[1]​###Root -> Categoría:Bebidas_destiladas"
Cóctel Chimayó,"El cóctel Chimayó fue creado por Arturo Jaramillo, dueño del restaurante Rancho de Chimayó en Chimayó, Nuevo México en 1965. El cóctel Chimayó es una bebida a base de tequila y sidra de manzana. Cuenta la leyenda que Jaramillo buscaba utilizar las manzanas que abundan en el valle de Chimayó cuando se topó con lo que pronto se convertiría en la bebida más destacada de su restaurante.###Root -> Categoría:Bebidas_destiladas -> Categoría:Licores -> Categoría:Cócteles con licor"
Cóctel de algarrobina,"El cóctel de algarrobina es un ponche peruano a base de pisco y algarrobina, y cóctel bandera del departamento de Piura.[1]​###Root -> Categoría:Bebidas_destiladas -> Categoría:Pisco -> Categoría:Cócteles con pisco",Cóctel de Algarrobina
Cointreau,"Cointreau (pronunciación en francés: /kwɛ̃tʁo/) es una marca comercial francesa de triple sec, un licor a base de cáscaras de naranjas. Fue creado en 1875 por Edouard Cointreau en su destilería de la ciudad de Angers (Maine y Loira), en la región de Países del Loira, Francia.[1]​ Famoso en el mundo entero, el Cointreau entra en la composición de muchos cócteles muy conocidos como el Margarita o el Cosmopolitan.[2]​###Root -> Categoría:Bebidas_destiladas"
Colombia,"El Colombia Cóctel contiene vodka y curazao. El efecto de capas se aprovecha de la variación entre la densidad y temperatura de los ingredientes, lo que forma las capas. La bebida se presenta como apiladas capas horizontales de amarillo, azul y rojo, que coincide con los tres colores de la bandera de Colombia.###Root -> Categoría:Bebidas_destiladas -> Categoría:Vodka -> Categoría:Cócteles con vodka"
Compañía Pisquera de Chile,"La Compañía Pisquera de Chile S.A. (CPCh) es una empresa filial de Compañía Cervecerías Unidas (CCU), que nació en marzo de 2005 de una asociación estratégica entre CCU y la Cooperativa Agrícola Control Pisquero de Elqui y Limarí Limitada (CPP), con el objetivo de desarrollar el negocio pisquero, mediante la producción y comercialización de pisco y otras bebidas alcohólicas elaboradas sobre la base de pisco. Es uno de los principales actores de la industria del pisco chileno. El acuerdo entre Pisco Control y CCU (directamente y a través de su filial Pisconor S.A.) contempló un joint venture para constituir una nueva sociedad anónima: ""Compañía Pisquera de Chile S.A."", a la cual las partes aportaron activos, marcas comerciales y pasivos. En un inicio, la Compañía Pisquera de Chile fue constituida con una participación de un 66% de CCPl y de un 34% para CCU, a través de Pisconor. Posteriormente CCU adquirió un 46% del capital accionario.  Así las cosas, en conjunto, CCU y Pisconor poseen el 80% de la Compañía Pisquera de Chile, mientras CCP mantiene el 20%.###Root -> Categoría:Bebidas_destiladas -> Categoría:Pisco"
Coñac,"El coñac es un tipo de brandy que se elabora a partir del vino de uva blanca de las cepas cultivadas en los alrededores de la ciudad de Cognac, zona relativamente cálida del departamento francés de Charente. La caliza del suelo contribuye a la calidad del coñac, debiendo su exquisito sabor y fragancia a los métodos de destilación y maduración de al menos dos años en cubas de roble. El Armañac, que se produce en la región francesa de Armañac, es una bebida similar al cognac. La ciudad de Cognac es una de las tres regiones con denominación de origen dentro de la Unión Europea para elaborar brandy. Las otras dos son Armagnac y Jerez de la Frontera. Existe una confusión extendida en España entre brandy y coñac. El brandy es el nombre genérico de un tipo de bebida, mientras que coñac es un tipo de brandy que procede de la región de Cognac, en Francia, el cual tiene un proceso específico tanto para su destilación (debe ser destilado como mínimo dos veces) como de selección de uvas destinadas a su producción. Coñac, del francés Cognac, se refiere a una denominación de origen registrada por Francia, como ocurre entre el cava y el champán, y debido a eso las empresas españolas no pueden emplear estos nombres.[1]​ A pesar de ser una diferencia bastante clara, es habitual hablar de un ""coñac de Jerez"" cuando en realidad se quiere hablar de un Brandy de Jerez. Coñac es la palabra habitual en España para referirse a este tipo de bebidas desde 1780. No puede adoptar el nombre geográfico de Cognac o «coñac» ningún derivado de vino español o francés que no proceda de esa región del oeste de Francia, ya que el nombre está protegido por una denominación de origen controlada (AOC).###Root -> Categoría:Bebidas_destiladas",Conac,Cognac Juanicó
Concurso de Vinos y Pacharán de Calidad de Navarra,"El Concurso de Vinos y Pacharán de Calidad de Navarra es un certamen con carácter anual que organiza la Asociación Navarra de Sumilleres para valorar y premiar a los mejores vinos y pacharán de la Comunidad Foral de Navarra, España.  El evento se lleva a cabo mediante la realización de una cata a ciegas a través de un jurado profesional.[1]​[2]​[3]​[4]​[5]​###Root -> Categoría:Bebidas_destiladas -> Categoría:Licores -> Categoría:Licores de España -> Categoría:Pacharán"
Copa Glencairn,"La copa Glencairn es una copa de cristal para whisky desarrollada en 2002 por la empresa escocesa Glencairn Crystal. En 2006, fue ganadora del Queen's Awards for Enterprise,[1]​ la distinción más alta de la industria del Reino Unido.[2]​ La forma de la copa hace que el contenido de whisky en su cáliz se evapore rápidamente , mientras el aroma se eleva concentrándose en boca angosta , la hace ideal para catadores y admiradores de esta bebida. Aunque no es la única copa diseñada expresamente para el whisky, es utilizada por todas las destilerías de Escocia y de Irlanda.[1]​###Root -> Categoría:Bebidas_destiladas -> Categoría:Whisky"
Cordial,"Cordial Bechefovka es un nombre de la bebida alcohólica producida por la compañía Karlovarská Becherovka, a.s.[1]​ en la ciudad de Karlovy Vary, República Checa. Cordial está basado en Becherovka, pero tiene menos de alcohol y más de azúcar, especialmente miel. Se produce desde el año 2008 como el sucesor del liquor Cordial Medoc,[2]​   == Referencias ==###Root -> Categoría:Bebidas_destiladas -> Categoría:Licores -> Categoría:Bíteres"
Cosmopolitan,"Un Cosmopolitan o Cosmo es un cóctel de vodka con cierto matiz a fruta ácida. Se prepara con vodka, triple seco (como Cointreau o Grand Marnier), zumo de arándanos rojos y zumo de lima recién exprimido. Suele servirse en copa de cóctel, adornado con piel de lima. En algunos aspectos, puede considerarse emparentado con el Margarita; también una fresca y colorida variante de un Martini.[1]​###Root -> Categoría:Bebidas_destiladas -> Categoría:Vodka -> Categoría:Cócteles con vodka",Cosmopolitan (coctel)
Courvoisier,"Courvoisier (pronunciación francesa: [kuʁvwɑzje]) es una marca de coñac. La compañía se basa ahora en la ciudad de Jarnac, en el departamento de Charente, Francia.###Root -> Categoría:Bebidas_destiladas"
Cream,"El Cream es un vino generoso de licor propio del Marco de Jerez y del Condado de Huelva, obtenido a partir de una mezcla de vino seco y vino dulce.[1]​###Root -> Categoría:Bebidas_destiladas -> Categoría:Vinos generosos -> Categoría:Condado de Huelva",Jerez dulce,Jerez cream,Vino Cream
