Ostkaka,"Ostkaka, ""ost"" meaning ""cheese"" and ""kaka"" meaning ""cake"" in Swedish (the definition of ""kaka"" includes ""cookie"" but is a wider concept), also known as Swedish cheesecake or Swedish curd cake, is a Swedish dessert that has its roots in two different parts of Sweden, Hälsingland and Småland, though there are some differences between ostkaka from Hälsingland resembling halloumi in texture, and the soft-grained ostkaka from Småland.The dish is usually eaten lukewarm with a jam or cordial sauce, typically cloudberry, cherries raspberry or strawberry though lingonberry is not uncommon; as well as fruits, cream or, more rarely, ice cream.
Despite the similarity in literal translation, ostkaka should not be confused with cheesecake. Swedes typically call the latter by its English name, sometimes making it ""American cheesecake"", to avoid confusion. Though even then, Scandinavian restaurant menus sometimes confuse the two."
lomo saltado,"Lomo saltado is a popular, traditional Peruvian dish, a stir fry that typically combines marinated strips of sirloin (or other beef steak) with onions, tomatoes, french fries, and other ingredients; and is typically served with rice. The dish originated as part of the chifa tradition, the Chinese cuisine of Peru, though its popularity has made it part of the mainstream culture."
Zürcher Geschnetzeltes,"Zürcher Geschnetzeltes (German for ""sliced meat Zürich style"", Züri-Gschnätzlets in Zürich German, émincé de veau zürichoise in French) is a Swiss dish from Zürich.
The first mention of Zürcher Geschnetzeltes is in a cookbook from 1947.  That recipe describes the ingredients as sliced veal strips, white wine, cream, and demiglace.  Some contemporary recipes may also call for mushrooms and sliced veal kidney."
Mantı,dish
queso quark,"Quark or quarg is a type of fresh dairy product made from milk. The milk is soured, usually by adding lactic acid bacteria cultures, and strained once the desired curdling is achieved. It can be classified as fresh acid-set cheese. Traditional quark can be made without rennet, but in modern dairies small quantities of rennet are typically added. It is soft, white and unaged, and usually has no salt added. It is traditional in the cuisines of Baltic, Germanic and Slavic-speaking countries.
Dictionaries sometimes translate it as curd cheese, cottage cheese, farmer cheese or junket. In Germany, quark and cottage cheese are considered to be different types of fresh cheese and quark is often not considered cheese at all, while in Eastern Europe cottage cheese is usually viewed as a type of quark (e.g. Russian for cottage cheese is ""зернёный творог"" zernyony tvorog, literally ""grainy quark"").
Quark is similar to French fromage blanc, Indian paneer, and the queso fresco/queijo fresco made in the Iberian Peninsula and in some Latin American countries. It is distinct from Italian ricotta because ricotta (Italian ""recooked"") is made from scalded whey. Quark is somewhat similar to yogurt cheeses such as the South Asian chak(k)a, Bengali chhena, the Arabic labneh, and the Central Asian suzma or kashk, but while these products are obtained by straining yogurt (milk fermented with thermophile bacteria), quark is made from soured milk fermented with mesophile bacteria."
balti,"A balti or bāltī gosht (Urdu: بالٹی گوشت, Hindi: बाल्टी गोश्त) is a type of curry served in a thin, pressed-steel wok called a ""balti bowl"". The name may have come from the metal dish in which the curry is cooked, rather than from any specific ingredient or cooking technique. Balti curries are cooked quickly using vegetable oil rather than ghee, over high heat in the manner of a stir-fry, and any meat is used off the bone. This combination differs sharply from a traditional one-pot Indian curry which is simmered slowly all day. Balti sauce is based on garlic and onions, with turmeric and garam masala, among other spices.Balti gosht is eaten in North India and some parts of Pakistan, as well as other parts of the world, such as Great Britain. The food seems to have arrived in England in Birmingham in 1971; sources suggest that it might have originated from Baltistan in northern Pakistan, but the exact origin is still unclear."
arroz frito,cooked rice stir-fried with eggs and other ingredients
Luther Burger,"A Luther Burger, or doughnut burger (among several naming variations), is a hamburger or cheeseburger with one or more glazed doughnuts in place of the bun.  These burgers have a disputed origin, and tend to run between approximately 800 and 1,500 calories (3,300 and 6,300 kJ)."
Chawanmushi,"Chawanmushi (茶碗蒸し, chawanmushi, literally ""tea cup steam"" or ""steamed in a tea bowl"") is an egg custard dish in Japanese cuisine. Unlike many other custards, it is usually eaten as a dish in a meal, as chawanmushi contains savory rather than sweet ingredients. The custard consists of an egg mixture flavored with soy sauce, dashi, and mirin, with numerous ingredients such as shiitake mushrooms, kamaboko, yuri-ne (lily root), ginkgo and boiled shrimp placed into a tea-cup-like container.  The recipe for the dish is similar to that of Chinese steamed eggs, but the toppings often differ. Since egg custards cannot be picked up by chopsticks, it is one of the few Japanese dishes that is eaten with a spoon.
Chawanmushi can be eaten either hot or cool. When udon is added as an ingredient, it is called odamaki mushi or odamaki udon."
Tong zi dan,"Virgin boy eggs are a traditional dish of Dongyang, Zhejiang, China in which eggs are boiled in the urine of young boys who were presumably peasants, preferably under the age of ten. Named ""tong zi dan"" (Chinese: 童子蛋; pinyin: Tóngzǐdàn), the dish translates literally to ""boy egg"" and is a springtime tradition of the city where the urine is collected from prepubescent peasant boys.

"
éclair,"An éclair (, ; French pronunciation: ​[e.klɛʁ]) is a pastry made with choux dough filled with a cream and topped with a flavored icing. The dough, which is the same as that used for profiterole, is typically piped into an oblong shape with a pastry bag and baked until it is crisp and hollow inside. Once cool, the pastry is filled with custard (crème pâtissière), whipped cream or chiboust cream, then iced with fondant icing. Other fillings include pistachio- and rum-flavoured custard, fruit-flavoured fillings, or chestnut purée. The icing is sometimes caramel, in which case the dessert may be called a bâton de Jacob. A similar pastry in a round rather than oblong shape is called a Religieuse."
Biryani,"Biryani (/bɜːrˈjɑːni/) is a mixed rice dish originating among the royal khansamas of the durbar of Old Delhi, under the Mughal Empire, during the late 16th century of the erstwhile Mughal Court. It is made with Indian spices, rice, and usually some type of meat (chicken, beef, goat, lamb, prawn, fish) or in some cases without any meat, and sometimes, in addition, eggs and potatoes.Biryani is one of the most popular dishes in South Asia, as well as among the diaspora from the region. Similar dishes are also prepared in other parts of the world such as in Iraq, Thailand, Singapore and Malaysia. Biryani is the single most-ordered dish on Indian online food ordering and delivery services."
Žganci,"Žganci is a dish in Slovenian and Croatian cuisine, known as Stirz in Austria, pura on the Croatian coast, and also known in northern Italy. It is a traditional ""poor man's food"" of hard-working farmhands similar to polenta, although prepared with finer grains."
Salzburger Nockerl,"Salzburger Nockerl (pl., Austro-Bavarian: Soizbuaga Noggal) are a sweet soufflé served as a dessert, a culinary specialty in the Austrian city of Salzburg."
Zosui,"Zōsui (雑炊, literally ""miscellaneous cooking""), or ojiya (おじや), is a mild and thin Japanese rice soup akin to a rice-based vegetable soup. It is made from pre-cooked rice and dashi or water seasoned with either soy sauce or miso and cooked with other ingredients such as meat, seafood, mushrooms, and vegetables. It is generally served to those who are sick or otherwise feeling unwell, and is usually only served in the winter.
Leftover soup from nabe is often re-used for zosui. Instead of rice, udon and ramen noodles are recent alternatives."
bsisa,"Bsisa (Arabic: بسيسة, Berber aḍemmin 
Hebrew: בסיסה) is a typical Mediterranean food, based on flour of roasted barley which dates back to Roman times.Bsisa is a variety of mixtures of roasted cereals ground with fenugreek and aniseed and cumin and sugar. This kind of food is known throughout Tunisia and Libya. Its history goes back a long way, and travellers and nomads used to take bsisa with them on their journeys since it was both full of nutritional value and easy to carry in its ground powder form.
The herbs and spices that are added to the mixture can vary, and the mixtures can also be used as a liquid when added to milk or water, creating a strongly floured drink called Rowina. The most common use for bsisa is to mix them with olive oil into a paste. This is then typically eaten with dates or figs for a quick meal which is energy-rich and healthy. 'Howira' is a similar mixture to Bsisa, however of a darker complexion and consists of similar ingredients.It is eaten by Tunisian and Libyan [[ muslims and Jews]] on various occasions, and especially the first day of the Hebrew month of Nisan as this is the day the Mishkan (tabernacle) was erected (in this case, the food is named bsiset el-marquma or simply Bsisa). The food is powder that consists of wheat and barley, which represents the mortar used to build the Mishkan. Additionally, the mother of the household puts her gold ring into the Bsisa, recalling the gold that was also used in the building of the Mishkan. Before eating the bsisa, the father of the household blesses in Arabic while he mixes the Bsisa using the key to his house with oil, recalling the oil used in the Mishkan  This symbolizes the ""opening"" of the 'new year' The father and family recite in turn:
Ya fetach,Bla Neftach,Arzekna warzek mennaYa atai,Bla mena!"
Ema datshi,"Ema datshi (Dzongkha: ཨེ་མ་དར་ཚིལ་; Wylie: e-ma dar-tshil) is among the most famous dishes in Bhutanese cuisine, recognized as a national dish of Bhutan. It is made from hot chili peppers and cheese; ""ema"" means ""chili"" and ""datshi"" means ""cheese"" in the Dzongkha language of Bhutan.
Different varieties of chilies may be used: green chili, red chili, or white chili (green chili washed in hot water and sun-dried), which may be dried or fresh. The chilies are called ""sha ema"" which is a Capsicum annuum cultivar, a form of pepper much like cayenne, poblano, ancho, or Anaheim.
The cheese in ema datshi is homemade from the curd of cow or yak's milk. In the process, the fat is removed from the curd to make butter, and the remaining curd without fat is used to make the cheese. After the cheese is made, a watery liquid is left over, which is used as a soup that can be taken with rice. No part of the curd is wasted."
Pom,"Pom is a Surinamese oven dish made using Arrowleaf elephant ear root, locally called ""pomtajer""."
macaroni casserole,"Macaroni casserole is a dish of baked pasta. It is especially known as a staple in northern European home cooking. It is a dish of cooked macaroni and a mixture of egg and milk with additional ingredients like meats, vegetables or fish. It is commonly made with cheese or breadcrumbs sprinkled on top.
The dish is reminiscent of a frittata, with the main difference being that it is baked entirely in the oven. It is usually eaten with ketchup."
Mitraillette,"A mitraillette (French pronunciation: ​[mitʁajɛt], literally ""submachine gun"") is a type of sandwich in Belgium commonly served at friteries and cafés. It is popular among students.It is thought to have originated in Brussels, but is also popular in Flanders, Wallonia, and the Nord region of France, where it is also known as an ""Américain"" (literally an ""American"")."
Khichri,"Khichdi or Khichri (Hindi: खिचड़ी, romanized: khicṛī, pronounced [ˈkʰɪtʃɽiː], Bengali: খিচুড়ি, Kannada: ಹುಗ್ಗಿ, Huggi) is a dish in South Asian cuisine made of rice and lentils (dal), but other variations include bajra and mung dal khichri. In Indian culture, in several regions, especially in the northern areas, it is considered one of the first solid foods that babies eat. Hindus, mainly from north/northwest, who avoid eating grains during fasting, eat Sabudana khichri made from sago.  In the southern part of India, however, the word khichri  is not that popular. While people of Tamil Nadu and Andhra regions cook Pongal, and Kannadigas prepare Huggi which is mung dal Khichidi and Bisi bele bhath, a pigeon pea variation with vegetables,  Keralites have no similar dish. Khichri is a salty porridge. Dalia is another similar sweet porridge made from the crushed wheat or barley mixed with sugar and milk.Khichdi was the inspiration for Anglo-Indian kedgeree and was said to be related to the Egyptian koshary, though the latter has more Italian influence."
ensalada rusa,salad dish of Russian origin
Stoemp,Belgian dish with stomped potatoes and vegetables
Corn dog,"A corn dog (also spelled corndog) is a sausage (usually a hot dog) on a stick that has been coated in a thick layer of cornmeal batter and deep fried. It originated in the United States and is commonly found in American cuisine.

"
Sesos de mono (gastronomía),"Monkey brains is a supposed dish consisting of, at least partially, the brain of some species of monkey or ape. 
While animal brains have been consumed in various cuisines (e.g. eggs and brains or fried brain sandwiches), there is debate about if monkey brains have actually been consumed. In Western popular culture its consumption is repeatedly portrayed and debated, often in the context of portraying exotic cultures as exceptionally cruel, callous, and/or strange."
Okinawa soba,"Okinawa soba (沖縄そば) is a type of noodle produced in Okinawa Prefecture, Japan. Okinawa soba is a regional collective trademark of The Okinawa Noodle Manufacturing Co-op. On Okinawa, it is sometimes simply called soba (or suba in Okinawan dialects), although this Japanese term typically refers to buckwheat noodles in mainland Japan.
The thick wheat noodles more closely resemble the texture of udon, and when served in soup, the broth is more similar to that of ramen. The noodles tend to have a circular cross section in the Yaeyama Islands and tend to be slightly flat in the rest of Okinawa Prefecture.
It is served in a broth flavored with konbu (edible seaweed), katsuobushi flakes and pork. Standard toppings are kamaboko (fish cake), sliced scallion and a thick slice of stewed san-mai niku (三枚肉, pork belly; lit. ""three-layer meat"") or soki (boneless pork ribs) and usually garnished with beni shōga (pickled ginger). For extra spice, diners can add a few drops of kōrēgūsu, which consists of chile peppers soaked in awamori rice liquor.
Varieties include:

Sōki soba (ソーキそば) - topped with extra ribs, known as sōki in Okinawan.
Tebichi soba (てびちそば) - topped with stewed pig's trotters."
Porkkanalaatikko,"Porkkanalaatikko (or, in Swedish, morotslåda, both meaning 'carrot casserole') is a traditional Finnish dish mostly eaten during Christmas.
The main ingredients are mashed carrots, mixed with boiled rice or barley, and liquid (usually milk or cream). Butter and eggs may be mixed into the mash, which may also be flavoured with sugar, salt, white pepper and grated nutmeg. The mash is put in a casserole dish and baked in the oven. The carrots need not necessarily be boiled before baking: they can be grated and mixed raw with the other ingredients. Readymade porkkanalaatikko is also sold in Finnish food stores around the Christmas season, as well as in parts of Sweden with a large ethnically Finnish population.
The dish seems to have originated in the nineteenth century."
Käsespätzle,"Käsespätzle (German for ""spätzle with cheese"", also called Käsknöpfle in Vorarlberg and Liechtenstein or Kasnocken in Tyrol) is a traditional dish of the German regions of Swabia, Baden and Allgäu, and also in the Austrian regions Vorarlberg and Tyrol, as well as Liechtenstein and Switzerland.

"
Tonkatsu,"Tonkatsu (豚カツ, とんかつ or トンカツ, pronounced [toŋkatsɯ]; ""pork cutlet"") is a Japanese dish that consists of a breaded, deep-fried pork cutlet. It involves coating slices of pork with panko (bread crumbs), and then frying them in oil. The two main types are fillet and loin. Tonkatsu is also the basis of other dishes such as Katsukarē and katsudon."
Crostini,"Crostini (meaning ""little crusts"" in Italian; singular crostino) are an Italian appetizer consisting of small slices of grilled or toasted bread and toppings. The toppings may include a variety of different cheeses, meats, vegetables and condiments, or may be presented more simply with a brush of olive oil and herbs or a sauce.
Along with bruschetta, crostini are thought to originate in medieval times when it was typical for peasants to eat their meals on slices of bread instead of using ceramics."
Rousong,"Rousong or yuk sung or bak hu (pronounced [ɻôʊsʊ́ŋ]; Chinese: 肉鬆; Cantonese Yale: yuk6 sung1), also known as meat floss, is a dried meat product with a light and fluffy texture similar to coarse cotton, originating from China. Rousong is used as a topping for many foods, such as congee, tofu, rice, and savory soy milk. It is also used as filling for various savory buns and pastries as well as a topping for baked goods filled with bean paste, for example, and as a snack food on its own. Rousong is a very popular food item in Chinese, Vietnamese (called ruốc in the North and chà bông in the South) and Indonesian dining."
Dal baati,Indian dish of lentils and unleavened bread
Bai ye,"Bai ye (English: tofu skin, Chinese: 百叶, pinyin: bái yè) is a main ingredient of some traditional Chinese dishes, such as bean curd skin roll (Chinese:百叶包, pinyin: bái yè bāo; literally ""Hundred Pages Bun"") that is widely known in southern regions of China and some of north regions of China and bean curd knot (Chinese:百叶结).  Tofu skin is a kind of pressed tofu. In China, pressed tofu comes in myriad shapes, sizes, and texture. Producers make tofu skin by pressing bean curds under much pressure."
Pkaila,"Pkaïla, also called bkaïla, bkeila, or pkela, is a Tunisian Jewish dish or condiment. It is one of the local variants of hamin, made from beans and spinach, as the name suggests. Pkaïla is often prepared for the holidays, accompanied by couscous or eaten alone."
lazanki,"Lazanki (Belarusian: лазанкі, Polish: łazanki, singular łazanka, Lithuanian: skryliai) is a Belarusian, Lithuanian and Polish type of pasta. It consists of wheat, rye or buckwheat kneaded into dough which is rolled thin and cut into triangles or rectangles. These are boiled, drained, and eaten with melted pork fat, vegetable oil and often sour cream. In Poland, they are commonly mixed with fried cabbage or with soured cabbage and small pieces of sausage, meat and/or mushrooms."
Conejo en salmorejo,"Salmorejo, sometimes known as ardoria or ardorío, is a traditional soup originating from Andalusia, southern Spain, made of tomato, bread, extra virgin olive oil and garlic. Normally, the tomatoes are skinned and then puréed with the other ingredients. The salmorejo is served cold and may be garnished with diced Spanish serrano ham and diced hard-boiled eggs.The bread used for salmorejo is called pan de telera, which is equivalent to Castilian pan candeal. This is a bread with a very dense and white crumb (as it is done with a variety of wheat flour that has a high protein content and less water and gluten content than other flours) and thin crust. Using this kind of bread is important to give salmorejo its characteristic texture.Salmorejo is more pink-orange in appearance than gazpacho, and is also much thicker and creamier in texture, because it includes more olive oil and bread and this is of a different kind (in gazpacho, usually stale loaf bread soaked in water is used). In Salmorejo, per 1 kg of tomatoes, 200 g of bread and 100 g of olive oil are used.  There are several variations in Andalusia, including ardoria and porra antequerana (with bits of tuna as topping).
Salmorejo is also the name given to a marinade typical of Canary Islands cuisine. It is used to flavour meat before cooking, especially rabbit (conejo en salmorejo) which is a speciality of the islands. Typical marinade ingredients include salt, garlic, paprika and hot peppers.
Salmorejo should not be confused with the southern Italian/Sicilian salmoriglio, despite both sharing the same etymology (from Latin salimuria meaning ""brine""). Whereas salmorejo is a tomato-based soup, salmoriglio is a sauce consisting of lemon, herbs, and olive oil."
Murukku,"Murukku (Malayalam - മുറുക്ക്, Tamil - முறுக்கு) is a savoury, crunchy snack originating from the Indian subcontinent. The name murukku derives from the Malayalam/Tamil word for ""twisted"", which refers to its shape. In India, murukku is especially popular in the states of Andhra Pradesh, Tamil Nadu, Karnataka, and Kerala. It is called murkulu or janthukulu in Andhra Pradesh. It is also popular in countries with substantial presence of Indian and Sri Lankan diaspora, including Singapore, Fiji, Malaysia, and Myanmar (Burma). Murukku, called sagalay gway (စာကလေးခွေ; lit. 'baby sparrow coils') in Burmese, is a common snack and is used as a topping for a regional dish called dawei mont di.Other names of the dish include   Kannada: ಚಕ್ಕುಲಿ chakkuli,  Odisha: ଦାନ୍ତକଲି Dantkali Tamil: முறுக்கு murukku, Marathi: चकली chakali,  Gujarati: ચકરી chakri, Telugu: చక్రాలు chakralu, or జంతికలు jantikalu and Konkani: Chakri or Chakkuli. 
Murukku is typically made from rice flour and urad dal flour. Chakli is a similar dish, typically made with an additional ingredient, bengal gram (chickpea) flour.
It is the origin of the saying in Tamil: பல்லற்ற தாத்தாக்கு முறுக்கு வேண்டுமாம் ('Toothless grandfather wants murukku'). It means someone wants something which they cannot use. (Murukku is quite hard and is not recommended for people suffering from a toothache, or wearing braces since it is known to have broken both.)"
Ahriche,"In Moroccan cuisine, Ahriche is a dish eaten by the tribes of Zayanes and Khénifra. The name is derived from the Berber word for stick; this is in reference to the dish's manner of cooking. It is a dish of tripe usually consisting of ganglion, caul, lung or heart of an animal wound with intestines on a stick of oak and cooked on hot coals."
Dagoberto,"A dagobert is a sandwich popular in Belgium, consisting of a baguette filled with ham, cheese and raw vegetables. The ""Belgicism"" dagobert was reported as being included in the Éditions Larousse 2019 edition of its dictionary."
Crudités,"Crudités (, French: [kʁydite]; plural only) are French appetizers consisting of sliced or whole raw vegetables which are typically dipped in a vinaigrette or other dipping sauce. Examples of crudités include celery sticks, carrot sticks, cucumber sticks, bell pepper strips, broccoli, cauliflower, fennel, baby corn, and asparagus spears."
Aguayón,"Rump steak is a cut of beef. The rump is the division between
the leg and the chine cut right through the aitch bone. It may refer to:

A steak from the top half of an American-cut round steak primal
A British- or Australian-cut from the rump primal, largely equivalent to the American sirloin

"
Spareribs,Spareribs
Jin deui,"Jiandui (Chinese: 煎䭔; pinyin: jiānduī; Cantonese Yale: jīndēui; lit. 'fried dumpling', common misspelling 煎堆) is a type of fried Chinese pastry made from glutinous rice flour. The pastry is coated with sesame seeds on the outside and is crisp and chewy. Inside the pastry is a large hollow, caused by the expansion of the dough. The hollow of the pastry is filled with a filling usually consisting of lotus paste, or alternatively sweet black bean paste, or red bean paste. They are also sometimes referred to as sesame balls (Chinese: 芝麻球; pinyin: zhīmáqíu; Cantonese Yale: jīmàkàu).Depending on the region and cultural area, jian dui is known as matuan (麻糰) in northern China, ma yuan (麻圆) in northeast China, and zhen dai (珍袋) in Hainan."
Maror,"Maror (Hebrew: מָרוֹר mārôr) refers to the bitter herbs eaten at the Passover Seder in keeping with the biblical commandment  ""with bitter herbs they shall eat it."" (Exodus 12:8)."
Pfefferpotthast,Pfefferpotthast (Low German: Piäpperpottharst) is a traditional German stew. It comes from the cuisine of Westphalia.
moules-frites,"Moules-frites or moules et frites (French pronunciation: ​[mul.fʁit]]; Dutch: mosselen-friet) is a main dish of mussels and French fries originating in Belgium. The title of the dish is French, moules meaning mussels and frites fries, with the Dutch name for the dish meaning the same. It is considered the national dish of Belgium.

"
