svele,"Svele (plural: sveler (indefinite), svelene (definite)), also known as lapp (plural: lapper), is a Norwegian batter-based cake. By size and texture they may bear some resemblance to American pancakes, but are usually eaten for afternoon coffee or as a snack between meals, served with butter and either sugar or brunost, folded in half to the shape of a crescent. Baking soda and salt of hartshorn are used as rising agent in svele, which give this cake its characteristic flavour. Recipes may differ slightly according to region or to house recipes, but usually include egg, sugar, kefir, wheat flour, and butter in addition to the above-mentioned rising agents. The svele is fried on a griddle or in a lightly buttered frying pan.
The svele is typical to the Møre og Romsdal region where since 1971 sveler have been served on board the ferries that connect communities across fjords and on islands. This tradition has spread throughout Western Norway, where svele is largely associated with ferry travels."
Takoyaki,"Takoyaki (たこ焼き or 蛸焼)  is a ball-shaped Japanese snack made of a wheat flour-based batter and cooked in a special molded pan. It is typically filled with minced or diced octopus (tako), tempura scraps (tenkasu), pickled ginger (beni shoga), and green onion (negi). The balls are brushed with takoyaki sauce (similar to Worcestershire sauce) and mayonnaise, and then sprinkled with green laver (aonori) and shavings of dried bonito (katsuobushi).
Yaki comes from yaku (焼く), which is one of the cooking methods in Japanese cuisine, meaning 'to grill', and can be found in the names of other dishes in Japanese cuisine such as okonomiyaki and ikayaki (other famous Osakan dishes).

"
bossam,boiled pork wraps
galantina,"Galantamine is used for the treatment of cognitive decline in mild to moderate Alzheimer's disease and various other memory impairments. It is an alkaloid that has been isolated from the bulbs and flowers of Galanthus nivalis (Common snowdrop), Galanthus caucasicus (Caucasian snowdrop), Galanthus woronowii (Voronov's snowdrop), and some other members of the family Amaryllidaceae, such as Narcissus (daffodil), Leucojum aestivum (snowflake), and Lycoris including Lycoris radiata (red spider lily).  It can also be produced synthetically.
Studies of usage in modern medicine began in the Soviet Union in the 1950s. Galantamine was isolated for the first time from bulbs of Galanthus nivalis (common snowdrop) by the Bulgarian chemist D. Paskov and his team in 1956. The active ingredient was extracted, identified, and studied, in particular in relation to its acetylcholinesterase (AChE)-inhibiting properties. The first industrial process was developed in 1959. However, it was not until the 1990s when full-scale synthesis was upscaled and optimized.Since the alkaloid was isolated from a botanical source, it only had contents around 0.1%, which caused the yield to also be extremely low—in the single digits."
Schlachteplatte,"A Schlachteplatte, Schlachtplatte, Schlachtschüssel (Southern German) or Metzgete (Swiss and southwestern part of Baden-Württemberg in Germany) is a hearty German dish that primarily consists of boiled belly pork (Kesselfleisch) and freshly cooked Blutwurst and Leberwurst sausages. The cooking process produces sausage juices which, together with any split sausages, are used as a soup known as Metzelsuppe. As a result, in many places, e.g. in parts of the Palatinate, the entire festival and the meal in particular are known as Metzelsupp.
Common accompaniments to a Schlachtplatte are sauerkraut and bread or potatoes or, in South Germany, potato pancakes (Dotsch or Reiberdatschi). Other elements might be fresh Bratwurst and Mettwurst or raw, spiced bratwurst filling. In Rhinehessen it is also common to enrich the dish with a  sauce from part of the pig's blood (Schweinepfeffer or Schwarz Brie).
The word is derived from schlachten, ""to slaughter"", and Platte, ""dish"", because, traditionally, it is only eaten on the day of slaughter; before the invention of refrigerators blood and sensitive organs like liver had to be prepared straight away. Meat, which did not have to be consumed immediately was preserved by salting, drying and smoking. The slaughtering day offered a rare opportunity to eat fresh meat which explains why the Schlachtplatte is a rather lavish meal.
Originally these slaughtering days took place mainly in the autumn. This meant that not so many animals had to be fed over the winter, the meat could be preserved for longer in the cooler temperatures and the farmers had more time after the last harvest for turning it into ham and sausages which could then be smoked over the winter hearth fire."
Fufu,pounded swallow made from fresh or fermented cassava roots and often eaten alongside various soups
cassoulet,"Cassoulet (, also UK: , US: ; French: [kasulɛ]; from Occitan caçolet [kasuˈlet] (listen) and cognates with Spanish: cazoleta and Catalan: cassolet) is a rich, slow-cooked casserole containing meat (typically pork sausages, goose, duck and sometimes mutton), pork skin (couennes) and white beans (haricots blancs), originating in southern France. It is named after its traditional cooking vessel, the casserole, a deep, round, earthenware pot with slanting sides.The dish is said to have originated in the town of Castelnaudary, and is particularly popular in the neighboring towns of Toulouse and Carcassonne. It is associated with the region once known as the province of Languedoc. An organization called The Grand Brotherhood of the Cassoulet of Castelnaudary (French: La Grande Confrérie du Cassoulet de Castelnaudary), has organized competitions and fairs featuring cassoulet every year since 1999."
Mermelada de coco,"Coconut jam, also known as kaya jam or simply kaya, is a sweet spread made from a base of coconut milk, eggs and sugar. It is popular throughout Southeast Asia."
Borsch frío,"Borscht (English:   (listen)) is a sour soup common in Eastern Europe and Northern Asia. In English, the word ""borscht"" is most often associated with the soup's variant of Ukrainian origin, made with red beetroots as one of the main ingredients, which give the dish its distinctive red color. The same name, however, is also used for a wide selection of sour-tasting soups without beetroots, such as sorrel-based green borscht, rye-based white borscht, and cabbage borscht.
Borscht derives from an ancient soup originally cooked from pickled stems, leaves and umbels of common hogweed (Heracleum sphondylium), a herbaceous plant growing in damp meadows, which lent the dish its Slavic name. With time, it evolved into a diverse array of tart soups, among which the Ukrainian beet-based red borscht has become the most popular. It is typically made by combining meat or bone stock with sautéed vegetables, which – as well as beetroots – usually include cabbage, carrots, onions, potatoes, and tomatoes. Depending on the recipe, borscht may include meat or fish, or be purely vegetarian; it may be served either hot or cold, and it may range from a hearty one-pot meal to a clear broth or a smooth drink. It is often served with smetana or sour cream, hard-boiled eggs or potatoes, but there exists an ample choice of more involved garnishes and side dishes, such as uszka or pampushky, that can be served with the soup.
Its popularity has spread throughout Eastern Europe and – by way of migration away from the Russian Empire – to other continents. In North America, borscht is often linked with either Jews or Mennonites, the groups who first brought it there from Europe. Several ethnic groups claim borscht, in its various local guises, as their own national dish consumed as part of ritual meals within Eastern Orthodox, Greek Catholic, Roman Catholic, and Jewish religious traditions.
In 2022, the United Nations Educational, Scientific, and Cultural Organization (UNESCO) announced that it had placed borscht on the List of Intangible Cultural Heritage in Need of Urgent Safeguarding due to the risk that Russia's invasion posed to the soup's status as an element of Ukraine's cultural heritage. The new status means Ukraine could now apply for special funds to finance projects promoting and protecting the dish."
raclette,"Galette (from the Norman word gale, meaning ""flat cake"") is a term used in French cuisine to designate various types of flat round or freeform crusty cakes, or, in the case of a Breton galette (French: Galette bretonne [galɛt bʁətɔn]; Breton: Krampouezhenn gwinizh du), a pancake made with buckwheat flour usually with a savoury filling. Of the cake type of galette, one notable variety is the galette des Rois (King cake) eaten on the day of Epiphany. In French Canada the term galette is usually applied to pastries best described as large cookies."
Crepe de alforfón,"A buckwheat pancake is a pancake made with buckwheat flour. Types of buckwheat pancake associated with specific regions include:

Blini, Eastern Europe, with a buckwheat variety particularly popular in Russia, Ukraine (hrechanyky or гречаники), and Lithuania (grikių blynai)
Crêpe bretonne, a savory pancake known as bleud ed-du  from Lower Brittany in France
Kaletez (galette de sarrasin), a buckwheat pancake in Breton cuisine
Memil-buchimgae, a variety of Korean pancake with buckwheat flour and cabbage
Ploye, a Canadian pancake, particularly popular in New Brunswick"
Caracoles a la llauna,"Caragols a la llauna (or cargols a la llauna, in certain dialects, or ""cargolada"" in Northern Catalonia) is a delicacy of Catalan cuisine. It is a simple plate for land snails cooked on a grill, or in a llauna (tin pan) in an oven. They are served with aioli or vinagrette. The dish is particularly favored in Terres de Lleida, where it has been promoted since 1980 by the Aplec del Caragol de Lleida, and in the Pyrenees. The same term is also used for a similar dish in Andorra."
mincemeat,"Mincemeat is a mixture of chopped dried fruit, distilled spirits and spices, and often beef suet, usually used as a pie or pastry filling. Mincemeat formerly contained meat, notably beef or venison. Many modern recipes replace the suet with vegetable shortening. Mincemeat is found in the Anglosphere."
Leberwurst,"Liverwurst, leberwurst, or liver sausage is a kind of sausage made from liver. It is eaten in many parts of Europe, including Austria, Bulgaria, Croatia, the Czech Republic, Denmark, Finland, Germany, Hungary, Latvia, the Netherlands, Norway, Poland, Romania (especially in Transylvania), Russia, Serbia, Slovakia, Slovenia, Sweden, Ukraine, United Kingdom; it is also found in North and South America, notably in Argentina and Chile.
Some liverwurst varieties are spreadable.  Liverwurst usually contains pigs' or calves' liver. Other ingredients are meat (notably veal), fat, and spices including ground black pepper, marjoram, allspice, thyme, ground mustard seed, and nutmeg. Many regions in Germany have distinct recipes for liverwurst. Adding ingredients like pieces of onion or bacon to the recipe make each variety of liverwurst very important to cultural identity. For example, the Thüringer Leberwurst (Thuringian liverwurst) has a Protected Geographical Status throughout the EU. Recently, more exotic additions such as cowberries and mushrooms have gained popularity."
ham and eggs,"Ham and eggs is a dish combining various preparations of its main ingredients, ham and eggs. It has been described as a staple of ""an old-fashioned American breakfast"". It is also served as a lunch and dinner dish. Some notable people have professed an affinity for the dish, such as Duncan Hines and Puyi. Similar dishes include bacon and eggs, Spanish eggs, the Denver omelette and Eggs Benedict.
The term ""ham and eggs"" and some variations of it have been used in various cultural contexts. It has been used as a slang term in the United States, and has also been used to refer to various entities and events in the United States.

"
Musa acuminata AAA Group Mutika/Lujugira Subgroup,"Matoke, locally also known as matooke, amatooke in Buganda (Central Uganda), ekitookye in southwestern Uganda, ekitooke in western Uganda, kamatore in Lugisu (Eastern Uganda), ebitooke in northwestern Tanzania, igitoki in Rwanda, Burundi and by the cultivar name East African Highland banana, is a starchy triploid banana cultivar originating from the African Great Lakes. The fruit is harvested green, carefully peeled, and then cooked and often mashed or pounded into a meal. In Uganda and Rwanda, the fruit is steam-cooked, and the mashed meal is considered a national dish in both countries.Matoke bananas are a staple food crop in Uganda, Tanzania and other Great Lakes countries. They are also known as the Mutika/Lujugira subgroup.
The medium-sized green fruits, which are of a specific group of banana, the East African Highland bananas (Musa AAA-EA), are known in the Bantu languages of Uganda as matoke.
Cooking bananas have long been and still are a common staple crop around the Lake Victoria area of Uganda, and in the West and Kilimanjaro regions of Tanzania."
Supersize,"Supersize is a phrase that means “to sizably increase the amount or the extent of something”.The phrase was particularly used by McDonald's restaurants to upsize their French fries and soft drinks to an extra-large size. In the United States, McDonald's introduced the supersized option in the summer of 1987.For Disney’s 1988 film “Who Framed Roger Rabbit,” instead of running a Happy Meal promotion targeted at children, they opted for a “super-size” promotion, “designed to appeal to teen-agers and young adults, the same as the movie's audience.”  The same held true for 1993 Steven Spielberg film “Jurassic Park”, when McDonald’s introduced Dino-Sized drink and fry options.In March 2004, McDonald's announced a plan to phase out the Supersize option, citing needs to simplify the menu and to offer healthier food choices.

"
lamian,"Lamia (; Greek: Λάμια), in ancient Greek mythology, was a child-eating monster and, in later tradition, was regarded as a type of night-haunting spirit (daemon).
In the earliest stories, Lamia was a beautiful queen of Libya who had an affair with Zeus. Upon learning this, Zeus's wife Hera robbed Lamia of her children, the offspring of her affair with Zeus, either by kidnapping or by killing them. The loss of her children drove Lamia insane, and in vengeance and despair, Lamia snatched up any children she could find and devoured them. Because of her cruel acts, her physical appearance changed to become ugly and monstrous. Zeus gave Lamia the power of prophecy and the ability to take out and reinsert her eyes, possibly because she was cursed by Hera with insomnia or because she could no longer close her eyes, so that she was forced to always obsess over her lost children.The lamiai also became a type of phantom, synonymous with the empusai who seduced young men to satisfy their sexual appetite and fed on their flesh afterward. An account of Apollonius of Tyana's defeat of a lamia seductress inspired the poem Lamia by Keats.
Lamia has been ascribed serpentine qualities, which some commentators believe can be firmly traced to mythology from antiquity; they have found analogues in ancient texts that could be designated as lamiai (or lamiae) which are part-serpent beings. These include the half-woman, half-snake beasts of the ""Libyan myth"" told by Dio Chrysostom, and the monster sent to Argos by Apollo to avenge Psamathe (Crotopus).
In previous centuries, Lamia was used in Greece as a bogeyman to frighten children into obedience, similar to the way parents in Spain, Portugal and Latin America used the Coco."
Lontong,Indonesian traditional rice cake originally from Java island
Cochifrito,"Cuchifritos (Spanish pronunciation: [kutʃiˈfɾitos]) or cochifritos refers to various fried foods prepared principally of pork in Spanish and Puerto Rican cuisine. In Spain, cuchifritos are a typical dish from Segovia in Castile. The dish consists of pork meat fried in olive oil and garlic and served hot. In Puerto Rico they include a variety of dishes including morcilla (blood sausage), papas rellenas (fried potato balls stuffed with meat), and chicharron (fried pork skin), and other parts of the pig prepared in different ways. Some cuchifritos dishes are prepared using plantain as a primary ingredient. Cuchifritos vendors also typically serve juices and drinks such as passionfruit, pineapple, and coconut juice, as well as ajonjolí, a drink made from sesame seeds."
Stromboli (alimento),"Stromboli is a type of turnover filled with various Italian cheeses (typically mozzarella) and usually Italian cold cuts (typically Italian meats such as salami, capocollo and bresaola) or vegetables. The dough used is either Italian bread dough or pizza dough. Stromboli was invented by Italian-Americans in the United States in the Philadelphia area. The name of the dish is taken from the 1950 film Stromboli, which in turn is named after a volcanic island off the coast of Sicily.
A stromboli is similar to a calzone, and the two are sometimes confused. Unlike calzones, which are always stuffed and folded into a crescent shape, a stromboli is typically rolled or folded into a cylinder, and may sometimes contain a thin layer of tomato sauce on the inside.

"
Arroz caldoso,"Arroz Caldoso is a dish which originated in Spain. It literally means ""brothy rice"" and consists of broth (bouillon) and rice with diverse flavourings and extra ingredients. The recipe is quite varied depending in which region of the Iberian peninsula it is prepared. Variations of this dish range from a recipe quite similar to Italian risotto, to a rice soup, to a dish that could be mistaken for paella."
Gulyásleves,"Gulyásleves (gulyás and leves mean herdsman and soup in Hungarian), is a Hungarian soup, made of beef, vegetables, ground paprika and other spices.  It originates from a dish cooked by the cattlemen (Hungarian: gulya = cattle herd, gulyás = cattle herder), who tended their herds in the Great Hungarian Plain (known as the Alföld or puszta in Hungarian). These Hungarian cowboys often camped out with their cattle days away from populated areas, so they had to make their food from ingredients they could carry with themselves, and this food had to be cooked in the one available portable cauldron (called bogrács) over an open fire.
The word bogrács is a loanword from Ottoman Turkish باقراج (spelled bakraç in modern Turkish), meaning a cauldron made of copper; from the word ""copper"" in Old Turkish language (spelled bakır in modern Turkish).
The original dish called bográcsgulyás was a stew, not a soup. Traditional Hungarian bográcsgulyás (cauldron goulash) is often still cooked outdoors over an open fire in a cauldron, giving the appearance of a barbecue. Later on when the dish left the peasant cuisines and became popular even in the town, it started to be cooked more like a soup. Nowadays the dish served in the Hungarian restaurants is a soup, but the locals cook the dish called gulyás as a stew and gulyásleves like a soup.
There are different variations of the recipe. The meat is beef, but often mixed meats are used (e.g. beef, pork and mutton or lamb). Tomatoes, carrots and fresh peppers (often hot chilies) are also added. Onions, paprika and caraway seeds provide its flavour. Cubed potatoes or pasta squares are typically added to this spicy soup. This dish is not to be confused with other dishes, like pörkölt or paprikás."
Agliata,"Agliata (Italian pronunciation: [aʎˈʎaːta]; from aglio, ""garlic""; Ligurian: aggiadda [aˈdʒadˑa]) is a savory and pungent garlic sauce and condiment in Italian cuisine used to flavor and accompany grilled or boiled meats, fish and vegetables. It is first attested in Ancient Rome, and it remains part of the cuisine of Liguria. Porrata is a similar sauce prepared with leeks in place of garlic."
sautéed reindeer,"Sautéed reindeer (Finnish: poronkäristys, Swedish: renskav, Norwegian: finnbiff, Northern Sami: báistebiđus) is perhaps the best known traditional meal from Sápmi, especially in Finland, Sweden, Norway and Russia and Sakha. Usually steak or the back of the reindeer is used. It is sliced thinly (usually while the meat is still frozen so that it is easier to cut through), fried in fat (traditionally in reindeer fat, but butter and oil are more common nowadays), and spiced with black pepper and salt. Finally, some water, cream, or beer is added, and it is cooked until tender. The dish is served with mashed potatoes and lingonberry preserves or, more traditionally, with raw lingonberries mashed with sugar. In Finland, the meat is often served with pickled cucumber, which is not as common in Sweden."
stroganina,"Stroganina (Russian строганина, literally ""shavings"") is a dish of the indigenous people of northern Arctic Siberia consisting of raw, thin, long-sliced frozen fish. Around Lake Baikal, the dish is referred to as raskolotka. Traditional stroganina is made with freshwater whitefish salmonids found in the Siberian Arctic waters such as nelma, muksun, chir, and omul. Rarely, it is made with sturgeon. This dish is popular with native Siberians, and is present in Yakutian cuisine, Eskimo cuisine, Komi cuisine and Yamal cuisine. It is often paired with vodka."
coniglio alla sanremese,"Rabbit alla Sanremese (or rabbit alla sanremasca, Cunìu a-a sanremasca in dialect) is a recipe based on rabbit, cooked and served with a sauce enriched with olives, walnuts and herbs.
Its a traditional dish of Ligurian cuisine.
The rabbit meat is ""al salto"" in a pan where onion, thyme, rosemary, a stalk of celery, a few walnuts, a glass of red wine and taggiasche olives are added. Separately, the liver and the head of the rabbit are cooked and pounded to extract the sauce.
The sauce can also be used to season pasta.With some variations the recipe is spread all over Liguria and is called Coniglio alla ligure."
Rheintaler Ribelmais,"Rheintaler Ribelmais, Rheintaler Ribel or Türggenribel is a ground product that is made from a traditional type of maize grown in the Swiss Rhine Valley and Liechtenstein. Since summer 2000, Rheintaler Ribel AOP (formerly AOC) has been the only Swiss cereal product with a protected geographical indication. The name Ribelmais comes from the traditional dish, Ribel, from which it is made."
Ahle Wurst,"The Ahle Wurst (or Aahle Worscht) is a hard pork sausage made in northern Hesse, Germany. Its name is a dialectal form of alte Wurst – ""old sausage"".
Depending on the shape it is also called ""Stracke"" if elongated or ""Runde"" if round.
Ahle Wurst is a sausage made of pork meat and bacon. Seasoned only with salt and pepper, there are regional differences and some butchers add nutmeg, cloves, pepper, sugar, garlic, cumin and rum or brandy.
In traditional manufacturing only heavy pigs are processed fresh (with the meat still warm) and quality cuts of meat produced. The slow maturation at relatively high humidity is the distinguishing mark of the sausage. The sausage can be smoked or made air-dried."
Mars frito,Deep fried Scottish confectionery
Tarta de arroz,"In Dutch and Belgian cuisine, rijsttaart(je)/rijstevlaai (Dutch) or tarte au riz (French) (German: Reisfladen, all translate to “rice flan”) is a pie with a filling based on rice pudding. It is native to Verviers and popular around the wider region of Eastern Belgium, south-eastern Netherlands and the German region around Aachen. It is best served cold.
Typically they are made 'single-crust'—with no layer of pastry covering the top."
faláfel,traditional Middle Eastern food: deep-fried balls of ground chickpeas or fava beans
Carbonade,"Flemish Stew, also known as stoofvlees or carbonnade or called à la flamande (in Dutch stoverij or stoofvlees) is a Flemish beef (or pork) and onion stew popular in Belgium, the Netherlands and French Flanders, made with beer, thyme, juniper berries, mustard and spiced bread. In French, a carbon(n)ade may also be a dish of grilled horse loin and certain beef stews cooked with red wine such as beef bourguignon in the east of France, but in English, carbonnade is generally the Belgian dish. The dish is occasionally called Flemish stew, but that is a generic term, also used for waterzooi, hochepot, and so on.Commonly recommended beers for this dish include Oud bruin (Old Brown Beer), Brune Abbey beer and Flanders red. Just before serving, a small amount of cider or wine vinegar and either brown sugar or red currant jelly are sometimes added.Carbonade is often accompanied by french fries, boiled potatoes or stoemp. It is widely available in restaurants and friteries in Belgium and the Netherlands."
Tzimmes,"Tzimmes, or tsimmes (Yiddish: צימעס, Hebrew: צִימֶעס), is a traditional Ashkenazi Jewish stew typically made from carrots and dried fruits such as prunes or raisins, often combined with other root vegetables (including yam).Tzimmes is often part of the Rosh Hashanah meal, when it is traditional to eat sweet and honey-flavored dishes. Some cooks add chunks of meat (usually beef flank or brisket). The dish is cooked slowly over low heat and flavored with honey or sugar and sometimes cinnamon or other spices.The name is a Yiddish word that, according to the Oxford English Dictionary, may come from the Middle High German word imbīz 'meal'. ""To make a big tzimmes over something"" is a Yinglish expression that means to make a big fuss, perhaps because of the slicing, mixing, and stirring that go into the preparation of the dish."
