Hawawshi,"Hawawshi (sometimes spelled hawwaoshi; Egyptian Arabic: حواوشي; IPA: [ħæˈwæwʃi]) is a traditional Egyptian dish. It is a pita stuffed with minced meat and spiced with onions, pepper, parsley, and occasionally chilies. The major variants of hawawshi are ""baladi"" (standard) and Alexandrian. In most of Egypt, it is baked by filling the flat Egyptian bread with the meat mix and then baking it in the oven. In Alexandria, the ingredients are placed between two circular layers of dough, then baked in an oven. Alexandrian hawawshi also usually have different spices and seasonings. Hawawshi has spread to other countries in the Middle East and North Africa with some variation. In the Levant, it is made using saj bread and includes hot peppers in the filling. In Algeria, it is known as ""muhajib"" and is eaten with soup or a yoghurt salad.Hawawshi is commonly made in Egyptian homes and is also served in some restaurants, usually as a take-away. Prices at restaurants range from £E10 to 30, depending on the size and amount of meat used."
Cağ kebabı,"Cağ kebabı (pronounced [ˈdʒaː cebabɯ]), also called Yatik Döner, is a horizontally stacked marinated rotating lamb kebab variety, originating in Erzurum Province, Turkey.
This uniquely prepared kebab has become, as years passed, a trademark of Erzurum where all the famous Usta, like Şakir Aktaş and Kemâl Koç, run restaurants. Each claiming to be descending from the exclusive inventors.
Note that while it is increasingly available in most Turkish cities, the Cağ kebabı is especially popular in Erzurum, whereas enjoying an ever-growing success in Istanbul and Ankara."
Palbochae,"Babaocai (Chinese: 八寶菜; pinyin: bābǎocài) is a typical Chinese dish that is made by frying various vegetables and seafood in oil.
Babaocai is a combination of eight ingredients called babao (八寶) and cai (菜), which means ""vegetables, dishes, side dishes"". Babaocai contains seafood such as sea cucumbers, shrimp, squid, and vegetables such as bamboo shoots. Sprinkle chili oil on a large, hollow plate and roast the seafood and ingredients.The dish is known as Palbochae (팔보채) in Korean and as Happosai in Japanese."
pollo a la naranja,Orange chicken or chen pi ji (traditional Chinese: 橙子雞; simplified Chinese: 橙子鸡; pinyin: chéngzǐ jī; Jyutping: caang2 zi2 gai1) is an American Chinese dish.
Gui,"In Korean cuisine, gui or guee (Korean pronunciation: [kuː.i]) is a grilled dish. Gui most commonly has meat or fish as the primary ingredient, but may in some cases also have grilled vegetables or other vegetarian ingredients. The term derives from the verb gupda (굽다), which literally means ""grill"". At traditional restaurants, meats are cooked at the center of the table over a charcoal grill, surrounded by various banchan and individual rice bowls. The cooked meat is then cut into small pieces and wrapped with fresh lettuce leaves, with rice, thinly sliced garlic, ssamjang (a mixture of gochujang and dwenjang), and other seasonings. The suffix gui is often omitted in the names of meat-based gui such as galbi, whose name is originally galbi gui."
Crawfish Monica,"Crawfish Monica is a Louisiana food tradition. Ingredients include pasta (often rotini), crawfish tail meat, onion, garlic, creole seasoning, cream, wine, salt, pepper, and butter. The dish was created by chef Pierre Hilzim who is the head of Kajun Kettle Foods. He named it after his wife Monica Davidson. Parsley can be used as a garnish. Shrimp, crabmeat and oysters can be substituted for crawfish."
dobin mushi,"Dobin mushi (土瓶蒸し) is a traditional Japanese seafood broth, steamed and served in a dobin tea pot with shrimp, chicken, soy sauce, lime, and matsutake mushroom."
Étouffée,"Étouffée or etouffee (French: [e.tu.fe], English:  AY-too-FAY) is a dish found in both Cajun and Creole cuisine typically served with shellfish over rice. The dish employs a technique known as smothering, a popular method of cooking in the Cajun and Creole areas of southwest Louisiana. Étouffée is most popular in New Orleans and in the Acadiana area of the southernmost half of Louisiana as well as the coastal counties of Mississippi, Alabama, northern Florida, and eastern Texas."
Sopa de cangrejo y maíz,"Corn crab soup is a dish found in Chinese cuisine, American Chinese cuisine, and Canadian Chinese cuisine. The soup is similar to cream of corn soup with egg white and crab meat or imitation crab meat added."
Fricot,"Fricot is a traditional Acadian dish. Fricot is such an important part of Acadian food culture that the call to eat in Acadian French is ""Au fricot!""The main ingredients consist of potatoes, onions, and whatever meat was available, cooked in a stew and topped with dumplings. The common meats used were chicken (fricot au poulet), clams (fricot aux coques), rabbit (fricot au lapin des bois), beef, or pork. When chicken was used, it was traditionally an older chicken, since an egg-laying chicken would have been too precious to cook. This accounts for the long cooking time, as an older chicken would have had tougher meat.
In lean times, a meatless fricot would be made. Fricot a la belette was one term for this, which means ""weasel stew"". The reference being made is that the cook is as sly as a weasel for leaving out the meat. In the opposite vein, Prince Edward Island Acadians use the term fricot a la bazette which means ""stupid cook's stew"", implying that the meat was forgotten.
The word fricot has its origins in 18th century France where it was used to mean a feast. The following century, it had evolved to mean ""meat stew"", and later still it became used to refer to prepared food."
Gigandes plaki,"Gigantes plaki (Greek γίγαντες πλακί pronounced [ˈʝiɣa(n)des plaˈci]) or Greek giant baked beans, is a Greek dish of large white beans baked in a tomato sauce. Gigantes plaki may be served as a main dish or as a meze. The beans are traditionally fasolia gigantes 'giant beans', a variety of the scarlet runner bean."
kağıt kebabı,"Kağıt kebabı is a type of Turkish kebab peculiar to Hatay province and its administrative capital Antakya.Kağıt kebabı is made from tomatoes, peppers, minced meat and spices. It is made using baking paper (kağıt) in an oven to trap the juices and flavours inside."
Revuelto de Gramajo,"Revuelto Gramajo (English: Gramajo Scramble) is a common hash dish in Argentinean cuisine consisting of fried julienned potatoes, ham and eggs. The dish can be adapted to use any ingredients the cook may have on hand, including peas, other fresh vegetables, fish, pork, and other meats. It is common in Buenos Aires, and has been described as one of the city's ""quintessential"" dishes. French fries are sometimes used as an ingredient in the dish."
espetada,"Espetada (also known as espetinho, especially in Brazil) is the Portuguese term used for the technique of cooking food on skewers, and for the dishes prepared that way. Espetada is a traditional dish in Portuguese cuisine.
In Portugal, espetadas can be prepared with different types of meat, as well as squid or fish, with monkfish being commonly used. The most common are beef or pork, or a mixture of the two. More recently, turkey or chicken is used. Often pieces of bell pepper, onion, and chouriço are placed between the meat pieces. Espatada is usually accompanied by white rice or potatoes, and salad.
In Madeira, beef on bay laurel skewers is a typical dish, with origins in the Strait of Câmara de Lobos. The meat, after being cut into cubes and before being grilled, is seasoned with salt, pepper, garlic and bay leaf. It is then cooked over hot coals or wood chips. Bolo do caco is usually eaten with it, or milho frito, fried squares or triangles of firmly set polenta, to soak up the juices of the meat.The dish can be served on a skewer which hangs from a hook on a stand for presentation."
Ghapama,"Ghapama (Armenian: ղափամա) is an Armenian stuffed pumpkin dish, often prepared during the Christmas season. It is prepared by removing the guts of the pumpkin (known as դդում in Armenian, pronounced dtum in Eastern Armenian and ttum in Western Armenian) and stuffing it with boiled rice and dried fruits such as chopped almonds, apple, cornel, apricot, plums, dates, prunes and raisins. It is also common to pour on honey and mix in ground cinnamon or sugar. The pumpkin is then baked until it becomes soft, then brought to the table where it is cut up and served.
There is an Armenian song about the meal known as Հէյ Ջան Ղափամա (Hey Jan Ghapama), popularized by Harout Pamboukjian."
hongshao rou,"Red braised pork belly or hong shao rou (simplified Chinese: 红烧肉; traditional Chinese: 紅燒肉; pinyin: hóngshāoròu) is a classic pork dish from mainland China, red-cooked using pork belly and a combination of ginger, garlic, aromatic spices, chilies, sugar, star anise, light and dark soy sauce, and rice wine. The pork belly is cooked until the fat and skin are gelatinous, soft, and melt easily in the mouth, while the sauce is usually thick, sweet and fairly sticky. The dish has a melt-in-the-mouth texture that is formed as a result of a long braising process, during which the liquid reduces and becomes thick. It is generally served with steamed rice and dark green vegetables, often over holidays. The dish is often prepared with hard-boiled chicken eggs or vegetables, which are used to soak up the juices from the recipe.Many Chinese provinces have slightly different versions, but the Hunanese one (often called ""Mao's family style red braised pork""  (Chinese: 毛氏紅燒肉; pinyin: Máo shì hóngshāoròu)) is often said to have been one of Chairman Mao's favorite dishes, and is served at the many Hunan restaurants across China specializing in so called ""Mao-style cuisine"". The popularity of the dish has led the Hunan provincial government to codify the recipe of the dish, in particular deciding that only meat of the celebrated Ningxiang breed of pig should be used in authentic hongshao rou."
Kare-kare,"Kare-kare is a Philippine stew (kare derives from ""curry"") that features a thick savory peanut sauce.  It is generally made from a base of stewed oxtail, beef tripe, pork hocks, calves feet, pig's feet or trotters, various cuts of pork, beef stew meat, and occasionally offal. Vegetables, such as eggplant, Chinese cabbage, or other greens, daikon, green beans, okra, and asparagus beans, are added. The stew is flavored with ground roasted peanuts or peanut butter, onions, and garlic. It is colored with annatto and can be thickened with toasted or plain ground rice. Variations of kare-kare can be made with seafood, such as prawns, squid, and mussels, or exclusively from vegetables. 
Condiments and other flavorings are usually added. It is often eaten with bagoong (shrimp paste), sometimes spiced with chili, ginisáng bagoóng (spiced and sautéed shrimp paste), and sprinkled with calamansi juice. Other seasonings are added at the table. Variants may include goat meat or (rarely) chicken.
Traditionally, any Filipino fiesta is not complete without kare-kare.A more modern twist to the classic Filipino kare-kare uses a different dish as the main meat for this dish. Pork is one of the most economical and easiest meats to cook.  The most common meats repurposed for kare-kare are Lechon (which is also used for Lechon Kawali) and Crispy Pata (Crispy Pork Shank.)  Alternative main proteins are tofu, beef chuck, beef shank, and Maskara ng Baka or cartilage from the cow's face, and tripe."
Sukalki,Sukalki is a typical dish from the Basque Country. It is a meat ragú. It is a complete meal that can be eaten by itself due to its high caloric level.
chả cá Lã Vọng,"Cha ca La Vong (Chả cá Lã Vọng in Vietnamese) is a Vietnamese grilled fish dish, originally from Hanoi. The dish is traditionally made with hemibagrus (or ca lang in Vietnamese), which is a genus of catfish. The fish is cut into pieces and marinated in a turmeric-based sauce, which often includes shrimp paste or fish sauce, ginger, and chili peppers. Sometimes, saffron is used instead of turmeric. It is then lightly grilled over charcoal. The dish is served in a hot pan coated with marinade sauce and herbs, particularly dill. Other herbs, such as scallions or basil, may be included. It is eaten with vermicelli rice noodles (bún in Vietnamese) and peanuts. Cha Ca La Vong is considered a delicacy in Vietnam, as it is nearly exclusively served in restaurants and is not found in street food.

"
Mtewem,"Tajine Mtewem, usually abbreviated to Mtewem (Arabic: طاجين مثوم) is a traditional Algerian dish, and more specifically Algerine (from the city of Algiers), the dish is made from minced meatballs, pieces of chicken or lamb meat, garlic, chickpeas and almonds. Its sauce is prepared with a grated onion and a lot of garlic, as its name suggests the word mtewem  means “with garlic"", and is usually cooked in a Tajine pot. like most Algerian dishes, it can be prepared with either a white sauce, or a red spicy sauce."
hújiāo bǐng,"Hújiāo bǐng or pepper bun (Chinese: 胡椒餅; pinyin: hújiāo bǐng; Pe̍h-ōe-jī: hô͘-chio-piáⁿ; lit. 'black pepper cake or biscuit') is a type of baked bun that originated in city of Fuzhou, the capital of China's Fujian province. It is a street food that has become popular in Taiwan and can be found in night markets or mini food stalls throughout Taiwan. The common ingredients are flour, water, and a leavening agent for the outer dough shell, and a meat protein (usually pork or beef) marinated with sugar, soy sauce, white pepper or black pepper, and scallion for the inside filling."
Pizza Margarita,"Pizza Margherita (more commonly known in English as Margherita pizza) is a typical Neapolitan pizza, made with San Marzano tomatoes, mozzarella cheese, fresh basil, salt, and extra-virgin olive oil."
manjar blanco,"Blancmange (, from French: blanc-manger [blɑ̃mɑ̃ʒe]) is a sweet dessert popular throughout Europe commonly made with milk or cream and sugar thickened with rice flour, gelatin, corn starch, or Irish moss (a source of carrageenan), and often flavoured with almonds.
It is usually set in a mould and served cold. Although traditionally white (hence the name, in English literally ""white eating""), blancmanges are frequently given alternative colours. Some similar desserts are French chef Marie-Antoine Carême's Bavarian cream, Italian panna cotta, the Middle Eastern muhallebi, Chinese annin tofu, Hawai'ian haupia and Puerto Rican tembleque.
The historical blancmange originated at some time during the Middle Ages and usually consisted of capon or chicken, milk or almond milk, rice, and sugar and was considered to be ideal for the sick. Tavuk göğsü is a sweet contemporary Turkish pudding made with shredded chicken, similar to the medieval European dish."
Baked Alaska,dessert dish of ice cream and meringue
Farsu magru,"Farsu magru, also spelled as farsumagru, and also referred to as farsumauru, falsomagro and falsumagru, is a traditional meat roll dish in Sicilian cuisine that dates to the 13th century. Farsu magru is available in many areas of Sicily, but some only serve it for special occasions. This roast is prepared mainly in rural regions in the interior of the island. Farsu magru means "" false lean"", which has been attributed to the amounts of meat used in the dish, and also to the lean, low-fat nature of the meats typically used.

"
Goxua,"Goxua (which means ""sweet"" in Basque) is a typical dessert from the Basque Country, especially from Vitoria-Gasteiz. Gasteiz pastry chef Luis Lopez de Sosoaga claims to have first created the dessert in 1977. Although its invention is popularly attributed to the pastry chef from Vitoria Luis López de Sosoaga, the pastry chef from Mirandese Alberto Bornachea affirms that goxua was invented by his father trying to copy the Catalan cream, baptizing the resulting dessert as cazuelita."
ugali,type of maize flour porridge made in Africa
Frikandel,"A frikandel (Dutch pronunciation: [frikɑnˈdɛl] (listen); plural frikandellen) is a traditional snack originating from the historical Low Countries (Netherlands, Belgium and north of France), a sort of minced-meat sausage,  
of which the modern version was developed after World War II. The history of this snack in the Spanish Netherlands goes back to the 17th century."
farofa,"Farofa (Brazilian Portuguese: [fa'ɾɔfɐ]) is a toasted cassava or corn flour mixture.  It is eaten mainly in Brazil.  It can be found commercially produced and packaged but can also be prepared at home based on family recipes.  Most recipes will also contain varying amounts of salt, smoked meat, and spices.  The consistency of the mixture ranges from large grains the size of cracked bulgur wheat or couscous down to a table-salt-sized powder. Most farofas have a very smoky and slightly salty taste, by and large used to accentuate the taste of meat, particularly barbecued meat and hearty stews.
In Brazil, where farofa is particularly popular, typical recipes call for raw cassava flour to be toasted with abundant butter, vegetable oil or olive oil, salt, bacon, onions, garlic, sausage, olives until golden brown. It is sometimes served as an accompaniment to Brazilian feijoada and Brazilian barbecue. In Brazil, farofa is also used in a stuffing for poultry and other dishes, usually containing raisins, nuts, and/or finely chopped sweet fruits like apples and bananas. In the state of Bahia, it is common for farofa to be prepared with dendê oil, giving it a stronger taste and a rich yellow coloring.
Farofa is served alongside the main course and can either be sprinkled on by individual diners to their taste before eating, or eaten as an accompaniment in its own right, as rice is often consumed. Besides cassava, corn meal is also used for farofa making.
In West Africa, a variant of cassava flour known as garri is used in various dishes.

"
Krautshäuptchen,"Krautshäuptchen, also Krautshäubchen is a stuffed cabbage, a specialty of northern Hesse, Germany. It is served with boiled potatoes and mustard sauce or bechamel sauce. Often the Krautshäuptchen discs are fried until golden brown before serving in the pan."
Lohikeitto,"Creamy salmon soup (Finnish: lohikeitto, Swedish: laxsoppa) is a common dish in Finland and other Nordic countries. It consists of salmon fillets, boiled potatoes, carrots and leeks. The soup is served hot, with some dill. There is a discussion about the ingredients of the dish, whether milk should be used as an ingredient. Milk may be substituted for cream, however it must be whole milk."
arroz a banda,"Arròs a banda (Valencian term for rice on the side, translated as Arroz a banda in Spanish) is a dish of rice cooked in fish stock, typical of the coastal area of Alicante (and, per extension, in most of the Valencian Community), Spain, and distinct from the paella of Valencia. It is popular up to  Garraf, Barcelona (Catalonia) and down to Murcia (Region of Murcia).
It originated with the fishermen of Alicante, who sold off their best fish and kept the leftovers for stock, used to cook the rice. It is usually served with alioli."
Romazava,"Romazava ([rumaˈzavə̥]) is the national dish of Madagascar, consisting of greens, zebu meat, tomatoes, and onions, typically accompanied by a portion of rice. An integral component of the stew is brèdes mafana, called anamalaho in Malagasy: The plant holds an acid amide called Spilanthol in its buds that elicits a tingly, pungent, citrusy and mouth-numbing effect, inducing excessive saliva production."
Qingtuan,"Qīngtuán (青糰) or Tsingtuan is a form of dumpling that is green, originating from Jiangnan but common throughout China. It is made of glutinous rice mixed with Chinese mugwort or barley grass. This is then usually filled with sweet red or black bean paste. The exact technique for making qingtuan is quite complicated and the grass involved is only edible in the early spring, so it is typically only available around the time of the Qingming Festival (April 4 or 5), with which the dumpling has become associated. Nowadays, Qīngtuán sold in most convenience stores in China are made of glutinous rice mixed with matcha. It also has more diverse fillings, such as rousong or salted egg yolk.
Much of the qingtuan consumed in China is prepared and consumed as street food from local vendors."
Zeeuws spek,"Zeeuws spek (pronounced [zeːws ˈspɛk]; ""Zeelandic bacon"") is a traditional Dutch bacon, originally a specialty from the province of Zeeland. Traditionally, it is seasoned with salt, pepper and herbs such as bay leaf, and slow-cooked. Modern Zeeuws spek is marinated, and then grilled, broiled, or smoked."
Seffa,"Seffa (Arabic: السفة) is a Maghrebi term for a dish of sweetened semolina cuscus with butter, cinnamon, and almonds. The dish may incorporate meat, and also alternatively be made with vermicelli or rice. This dish is generally consumed at the end of a meal, before dessert. It is often served at traditional marriage ceremonies and family gatherings.Seffa can also be served with chicken (السفة بالدجاج) or with raisins (السفة الحلوة بالزبيب).According to Emily Gottreich, the version of seffa involving a mixture of butter with chicken, or other meat, is a ""distinctively Moroccan dish"" traditionally only found in Muslim homes owing to the Jewish dietary prohibition on the mixing of meat and dairy in a single meal.However, seffa in its simpler form, flavoured with just sugar and cinnamon, is prepared by Moroccan Jewish communities on the
night of the Mimouna. This dish is also known by the French: Couscous Sucré et Sec (sweet and dry couscous).There are also sweetened cuscus dishes besides seffa, such as mesfouf."
Raviole du Dauphiné,"Ravioles du Dauphiné (in English, 'Dauphiné ravioli'), also known as Ravioles de Romans ('Ravioli of Romans'), are a French regional speciality consisting of two layers of pasta made out of tender wheat flour, eggs and water, surrounding a filling of Comté or French Emmental cheese, cottage cheese made of cow's milk, butter and parsley, akin to Italian ravioli or Russian pelmeni. As the name suggests, they are usually associated with the historical region of Dauphiné in South-Central France, particularly around the town of Romans-sur-Isère in the department of Drôme, Auvergne-Rhône-Alpes. The Ravioles du Dauphiné appellation has been legally protected since 1989, and received the Label Rouge in 1998, however is not an AOC as it makes use of ingredients such as Emmental and Comté which originate outside the Dauphiné region."
șodou,"Șodou is a culinary preparation from Romania. It looks like a sabayon. The șodou is obtained by incorporating sweet wine with egg yolks together with sugar. This mixture is boiled in a bain-marie, until fluffy. The șodou is served hot or warm. The șodou is intended to accompany diced fruit.The term șodou comes from the French chaudeau, or ""hot water""."
Ful medames,"Ful medames (Arabic: فول مدمس, fūl mudammas IPA: [fuːl mudammas]; other spellings include ful mudammas and  foule mudammes), or simply fūl, is a stew of cooked fava beans served with olive oil, cumin, and optionally with chopped parsley, garlic, onion, lemon juice, chili pepper, and other vegetable, herb, and spice ingredients. Ful medames is traditionally made in and served out of a large metal jug. It is notably a staple food in Egypt and is considered a national dish, especially in the northern cities of Cairo and Gizah. Ful medames is also a common part of the cuisines of many Arab, Middle Eastern, and North African cuisines."
Hash,"Hash is a culinary dish consisting of chopped meat, potatoes, and fried onions. The name is derived from French: hacher, meaning ""to chop"". It originated as a way to use up leftovers. In the USA by the 1860s, a cheap restaurant was called a ""hash house"" or ""hashery.""Canned corned beef hash became especially popular in countries such as Britain, France, and the United States, during and after the Second World War as rationing limited the availability of fresh meat.Hash may be served for breakfast, lunch, or supper. When served for breakfast in the United States hash may come with eggs, toast, hollandaise sauce, or even baked beans.High-end restaurants offer sophisticated hash dishes on their menus. Modern preparations can be made with unconventional ingredients such as lamb, fish, venison, turkey, chicken, shrimp, or steak."
Harira,"Harira (Arabic: الحريرة al-ḥarīra, Tachelhit: ⴰⵣⴽⴽⵉⴼ azkkif or ⴰⵙⴽⴽⵉⴼ askkif) is a traditional North African soup prepared in Morocco and Algeria. Algerian harira differs from Moroccan harira in that Algerian harira does not contain lentils. It is popular as a starter but is also eaten on its own as a light snack. There are many variations and it is mostly served during Ramadan, although it can be made throughout the year.It is also part of the Maghrebi cuisine, where lemon juice and egg is added to brighten the flavors of the soup. Like Muslims, who traditionally have the filling soup for Iftar meals, Jews break their fast with it during Yom Kippur."
Pølser,"Rød pølse (listen , ""red sausage"") is a type of brightly red, boiled pork sausage very common in Denmark. Since hot dog stands are ubiquitous in Denmark, some people regard røde pølser as one of the national dishes. They are made of the Vienna type and the skin is colored with a traditional red dye (carmine)."
