khao kha mu,"Khao kha mu (Thai: ข้าวขาหมู, pronounced [kʰâːw kʰǎː mǔː], lit.: 'pork-leg rice'; Chinese: 猪脚饭, pinyin: zhū jiǎo fàn), or sometimes simply called kha mu (ขาหมู), is a popular Thai food. It is influenced by Chinese cuisine, specifically Teochew cuisine.Khao kha mu is an individual dish consisting of stewed pig's trotter in seasoning condensed hot pottage (some recipes are mixed with cocoa powder or boiled peanuts ), then it will be cut into thin slices and topped on steamed rice. The dish is served with half spiced corned eggs, small pieces of pickled mustard greens and occasionally blanched chinese broccoli with fresh bird's eye chili peppers and cloves of garlic on the side. Sometimes it is eaten with clear broth soup. The accompanying dipping sauce is most often made of yellow chili peppers, garlics, granulated salt, limeade and vinegar.
Khao kha mu is a food that can be found online from street stalls, food courts in department stores to the luxury restaurants.
For Bangkok, there are many famous khao kha mu restaurants in various neighbourhoods such as Bang Wa, Phlapphla Chai, Mo Mi, Sam Yan, etc. Some restaurant in Bang Rak received Bib Gourmand awards twice in both 2018 and 2019 Michelin Guide."
Igado,"An igloo (Inuit languages: iglu, Inuktitut syllabics ᐃᒡᓗ [iɣˈlu] (plural: igluit ᐃᒡᓗᐃᑦ [iɣluˈit])), also known as a snow house or snow hut, is a type of shelter built of suitable snow.
Although igloos are often associated with all Inuit, they were traditionally used only by the people of Canada's Central Arctic and the Qaanaaq area of Greenland. Other Inuit tended to use snow to insulate their houses, which were constructed from whalebone and hides. Snow is used because the air pockets trapped in it make it an insulator. On the outside, temperatures may be as low as −45 °C (−49 °F), but on the inside, the temperature may range from −7 to 16 °C (19 to 61 °F) when warmed by body heat alone.

"
Nauryz kozhe,"Nauryz kozhe (Kazakh: наурыз көже; Kyrgyz: нооруз көже) is a Kazakh/Kyrgyz drink of milk, horse meat, salt, kashk and grains.On Nauryz (Nooruz), the Kazakh and the Kyrgyz start the new year with this drink for good luck because it is considered a symbol of wealth and richness in the coming year. It consists of seven food elements, such as milk, meat, oil, millet, rice, raisins, corn (the recipe can vary)."
tiempo,"In dining, a course is a specific set of food items that are served together during a meal, all at the same time. A course may include multiple dishes or only one, and often includes items with some variety of flavors. For instance, a hamburger served with French fries would be considered a single course, and most likely the entire meal. Likewise, an extended banquet might include many courses, such as a course where a soup is served by itself, a course where cordon bleu is served at the same time as its garnish and perhaps a side dish, and later a dessert such as a pumpkin pie. Courses may vary in size as well as number depending on the culture where the meal takes place.Meals are composed of one or more courses, which in turn are composed of one or more dishes.
When dishes are served mostly in a single course, this is called service à la française; when dishes are served mostly in separate courses, this is called service à la russe."
Czech-style hot dog,"Different areas of the world have local variations on the hot dog, in the type of meat used, the condiments added, and its means of preparation."
Slavski kolač,"Slavski kolač (Serbian Cyrillic: Славски колач) is a traditional Serbian cake (a type of yeast bread). It is made for the Orthodox Christian celebration of Slava, a UNESCO's Representative List of the Intangible Cultural Heritage of Humanity. The parish priest visits the family to consecrate the kolač and red wine, and to light a beeswax candle stamped with an image of the saint.Often extended family and friends are invited to the celebration. Wine is poured over the cake, and it is cut or broken by members of the family before lunch."
Afritada,"Afritada is a Philippine dish consisting of chicken, beef, or pork braised in tomato sauce with carrots, potatoes, and red and green bell peppers. It is served on white rice and is a common everyday Filipino meal. It can also be used to cook seafood."
Strapačky,"Strapačky (Slovak) or sztrapacska (Hungarian) is a dish popular in Slovakia and Hungary. It is similar to bryndzové halušky where the base compound of the dish is halušky (dumplings); however, in Slovakia, instead of bryndza, stewed sauerkraut is used. In Hungary, sztrapacska is traditionally accompanied with juhtúró, the local equivalent to bryndza. Residents of Vanyarc, located in Hungary approximately 80 kilometers from Budapest, have held a Festival of Strapačky (Vamyarci Haluskafesztivál) every September for almost 40 years. Ethnic Slovaks from all over Hungary compete for prizes at the festival."
Rondón (plato),"Run down, also referred to as rundown, run dun, rondón, fling-me-far, and fling mi for, is a stew dish in Jamaican cuisine and Tobago cuisine. The traditional Jamaican dish is eaten in several Latin American countries that share a coast with the Caribbean Sea.
It consists of a soup made up of reduced coconut milk, with different types of seafood (fish, crabs, small lobsters or shellfish), plantain, yam, tomato, onion, and seasonings. Mackerel and salted mackerel are often used in the dish. Other fish are also used, including locally caught fish, cod, salt cod, shad, other oily fish, red snapper, swordfish, pickled fish, bull pizzle, and cassava. Traditionally, the dish is served with side dishes of dumplings or baked breadfruit.Run down is typically available in Jamaican restaurants, and is also a traditional Jamaican breakfast dish. It is a common dish in the Antilles, insular Colombia, Panama, Costa Rica, Nicaragua and Venezuela, also."
Pholourie,"Pholourie (Pronunciation), also spelled phulourie or phoulourie, is a snack food of Indo-Caribbean origin that is commonly eaten in Trinidad and Tobago as well as  in Guyana, Suriname and other parts of the Caribbean. It consists of fried, spiced spilt pea and flour dough balls that are served with a chutney."
Thiakry,"Thiakry (also spelled thiacry or chakery) or Degue is a sweet millet couscous dish originating in Senegal.  The wheat or millet granules are mixed with milk, sweetened condensed milk, or yogurt, as well as dried fruit such as raisins, desiccated coconut, and spices such as nutmeg."
Zeroa,"Zeroa (Hebrew: זרוֹע) is a lamb shank bone or roast chicken wing or neck used on Passover and placed on the Seder plate. It symbolizes the korban Pesach (Pesach sacrifice), a lamb that was offered in the Temple in Jerusalem, then roasted (70 CE) during the destruction of the Temple, the z'roa serves as a visual reminder of the Pesach sacrifice. In Ashkenazi and many Sephardi families, it is not eaten or handled during the Seder, as it represents a sacrifice made at the Temple, but is not actually, making it taboo to eat. Vegetarians often substitute a beet, quoting Pesachim 114b as justification."
palate cleanser,"A palate cleanser is a neutral-flavored food or drink that removes food residue from the tongue allowing one to more accurately assess a new flavor. In cultures where diversity of flavors in dishes is customary, the palate cleanser is considered an essential companion to main dishes.Palate cleansers are often used between tasting wine or cheese or other strong flavors. Pickled ginger is used as a palate cleanser between sushi pieces.Some widely used palate cleansers are sorbet, bread, apple slices, banana, biko and pickles. Tart or citrus flavors are also used as a cleanser, such as braised pineapple or grapefruit.
Bamia is a traditional Anatolian stew that is sometimes served as a palate cleanser between food courses at ceremonial feasts."
chaku,"Chaku (Nepali: चाकु pronounced [ˈt͡saku] (listen)) is a Newari cuisine made from concentrated sugarcane juice, jaggery, ghee, and nuts. The mixture is cooked down until it is a solid form, and then pulled on a hook in a manner similar to making taffy and then cut into small rolls, or it may be cooked in a shallow dish and cut into small diamond shaped pieces. Chaku may be eaten separately, or it can also used in making Yomari (योमरी).
Chaku is served by Nepalese with ghee and yams during the festival of Maghe Sankranti."
Kandaulos,"Kandaulos (Ancient Greek: κάνδαυλος, also κάνδῡλος, ὁ) was an ancient Greek luxury dish of Lydian origin. The  Ionian rich savoury confection was a new delicacy in Athens in the early 4th century BC.
According to the Greek rhetorician and grammarian Athenaeus (late 2nd century AD), kandaulos came in three forms. One of them was sweet, and is described by one Hellenistic source as a πλακοῦς, flat cake. A second was savoury, consisting of meat and broth with breadcrumbs. However, what these two kinds of kandaulos had in common with one another or with the third kind is not clear.The term kandaulos appears to be related to the Lydian word  Kandaules (Κανδαύλης), recorded by Hipponax and Herodotus. This was a title of Hermes and Heracles and name or title of a Lydian king. But Tzetzes, a Byzantine poet and grammarian from the 12th century, says that kandaules was also Lydian for dog-throttler.Athenaeus (Deipnosophists XII 516c-d) quotes a brief recipe for the meaty version of kandaulos from Hegesippus of Tarentum, an author of Greek works on cookery and on cake-making of the 4th century BC:
The Lydians used also to speak of a dish called kandaulos, of which there were three varieties, not one merely; so exquisitely equipped were they for luxurious indulgence. Hegesippus of Tarentum says that it was made of boiled meat, bread crumbs, Phrygian cheese, anise, and fatty broth.
In the original Greek:
καὶ κάνδαυλον δέ τινα ἔλεγον οἱ Λυδοί, οὐχ ἕνα ἀλλὰ τρεῖς· οὕτως ἐξήσκηντο πρὸς τὰς ἡδυπαθείας. γίνεσθαι δ᾽ αὐτόν φησιν ὁ Ταραντῖνος Ἡγήσιππος ἐξ ἑφθοῦ κρέως καὶ κνηστοῦ ἄρτου καὶ Φρυγίου τυροῦ ἀνήθου τε καὶ ζωμοῦ πίονος."
Lychee pork,"Lychee pork or lizhi rou (Chinese: 荔枝肉; pinyin: lìzhī ròu; Eastern Min: liĕk-chiĕ-nṳ̆k) is one of the most well known dishes in Fujianese cuisine. Small pieces of deep-fried pork and sliced water chestnut are served in a sweet and sour sauce. As is typical in Fujian, red yeast rice is used to add flavor and give a bright red color. The pork pieces curl up when cooked and are stained red, thus resembling lychee skins, hence the name. The taste mixes sweet and sour, which is common in southern Chinese cuisine; the sauce is commonly made with ketchup, soy sauce and rice vinegar. Additional vegetable ingredients are yams, tomatoes, and green onions."
Bibikkan,"Bibikkan (Sinhala: බිබික්කන්) is a traditional Sri Lankan coconut cake. It is a dark moist cake made of shredded coconut, jaggery (from the sap of the toddy palm) and semolina combined with a mixture of spices. Bibikkan is commonly prepared and consumed in celebration of festive and religious occasions, including Christmas, New Year's Eve, Sinhala and Tamil New Year."
Cholera,"In the Valais region of Switzerland, a cholera is a savoury pastry filled with potatoes, vegetables, fruits and cheese.
The unusual name is linked to the history of the dish. During an epidemic of the disease cholera in 1836, people in the region improvised a dish involving pastry and whatever food they had at hand, as normal trade was disrupted. After the epidemic subsided, chefs returned to the concept of putting regional ingredients in a savoury tart, and the ""cholera"" dish has lasted since.Originally, the local ingredients for such a dish were apples, pears, potatoes, onions, leeks, raclette cheese (usually Gomser) and bacon. The dish is mostly known in the region of Wallis in Switzerland."
Shkmeruli,Shkmeruli (Georgian: შქმერული) is a traditional Georgian dish of chicken in garlic sauce.
Pârjoale,"Pârjoale (also called Moldavian Pârjoale; Romanian: Pârjoale moldovenești), plural form of pârjoală, are Romanian and Moldovan meatballs, usually minced pork and beef (sometimes lamb or chicken) mixed with eggs, grated potatoes, slices of bread soaked in milk or water, chopped onions, herbs (parsley, dill, thyme), spices (pepper) and salt, homogenized to form balls which are flattened to an elongated shape, passed through bread crumbs, and fried in hot oil. 
They can also be marinated in a tomato sauce."
čvarci,"Čvarci (singular čvarak, Serbian Cyrillic: чварци / чварак, pronounced [t͡ʃʋǎːrt͜si], [t͡ʃʋǎːrak], Slovene: ocvirki, Romanian: jumări, Polish: skwarki, Czech: škvarky, Slovak: škvarky, oškvarky, German: Grammeln, Ukrainian: шкварки, romanized: shkvarky, Hungarian: töpörtyű, Macedonian: чварки/џимиринки) is a specialty popular in Southeastern Europe, a variant of pork rinds. They are a kind of pork cracklings, with fat thermally extracted from the lard.
Čvarci are mostly a rustic countryside specialty, common to the cuisines of Serbia, continental Croatia, Slovenia,  Romania, and Macedonia. They can also be found in other countries throughout Central and Eastern Europe: in Poland, Czechia, Slovakia, Austria, Hungary, and Ukraine. They are usually homemade, with industrial production not as pronounced. In larger cities they can be obtained on farmer markets or in supermarkets."
Kebab con cereza,"Cherry Kebab (Arabic: كباب كرز) is a special kind of kebab, which is made with minced lamb and cherry. The name in Arabic is Kebab B’il Karaz. Additional names and varieties include kebab garaz (Jewish), cherry kabab, kabab bil karaz, cherry meatballs, kebab con cerezas (Mexican), and fishnah kabab (Armenian).

"
Chimole,"Chimole is a dish common in Yucatán, Mexico and Belize and is also known as ""Black Dinner"" because of its dark appearance. Ingredients include spices and some black recado (achiote paste, a blend of spices commonly used in Maya cuisine) in block pieces. This dish was first known by Yucatec Maya, but because of the Belize's vast cultural diversity, most Belizeans are making it in their homes and for special occasions."
Braised pork rice,"Khong bah png (Chinese: 炕肉飯; Pe̍h-ōe-jī: khòng-bah-pn̄g, alternatively 焢肉飯, 爌肉飯), as known as Braised pork rice, is a gaifan dish found in Fujianese cuisine and Taiwanese cuisine. Although subject to regional variations, dishes are typically made of pork belly cooked in a process known as lu (boiled and marinated in soy sauce and sugar) and served on top of rice. Chinese pickles are often eaten with the dish. 
Braised pork belly likely originated from Quanzhou, China, and was brought to Taiwan by immigrants during the Qing Dynasty. Along with the similar lo bah png (minced pork rice), khong bah png gradually became an integral part of Taiwanese xiaochi culture, commonly found at food stalls or bento stores. Similar dishes can be found within Hakka cuisine, Singaporean, and Malaysian cuisine. Braised pork rice is one of the most notable Taiwanese foods."
Seblak,"Seblak (Sundanese: ᮞᮨᮘᮣᮊ᮪) is an Sundanese savoury and spicy dish, originating from West Java, Indonesia. Made of wet krupuk (traditional Indonesian crackers) cooked with protein sources (egg, chicken, seafood or beef) in spicy sauce. Seblak is a specialty of Bandung city, West Java, Indonesia. Seblak is common at restaurants, warungs, and gerobak (cart) street vendors. It is one of the most popular street foods in Indonesia, especially in Bandung and Jakarta."
Qarta,Quarta is a surname. Notable people with the surname include:
Crab jujube,"Crab jujube or hoi jo (Chinese: 蟹棗; lit. 'crab jujube'; Peng'im: hoi6 jo2; Thai: ฮ่อยจ๊อ, RTGS: hoicho, pronounced [hɔ̂j.t͡ɕɔ́ː]) is a Chinese dish from Chaozhou which contains a set of small deep-fried, jujube fruit-shaped, crab cakes. Its main ingredients are crab meat, pork fat (or ground pork belly), chopped water chestnuts, eggs, vegetables, and herbs, which are wrapped into a sheet of fresh tofu skin, forming long rolls, cut into bite-sized pieces, and deep-fried. Crab jujube is a popular dish among Thai Chinese people in Thailand where it is known as hoicho."
olluquito con charqui y de pollo,"Olluquito, olluquito con carne (with meat) and olluquito con ch'arki (with dried llama meat) are traditional dishes in Peruvian cuisine made with ulluku (Quechua, hispanicized spellings ulluco, olluco) a root vegetable that also has edible leaves. It is an important root crop in the Andean region of South America, second only to the potato. The leaf and the tuber are edible; the leaves are similar to spinach, and the root is like a potato or jicama. The Ulluku contains high levels of protein, calcium, and carotene. Papalisa were used by the Incas prior to arrival of Europeans in South America. It can be served with meat.Ch'arki is the technique employed in the Andean highlands to cure meat by salting, then dehydration. Incidentally the word ""jerky"" in English is derived from this Andean (Quechua) word. The dish is a stew of finely diced ulluku with ch'arki pieces (traditionally alpaca, or less frequently llama meat, though today it is also very commonly made from sheep), served with white rice."
vigoron,"Vigorón is a traditional Nicaraguan dish. It consists of a cabbage salad (chopped cabbage, tomatoes, onions, and chili pepper marinated in vinegar and salt), boiled yuca, and chicharrones (fried pork belly or fried pork rinds), all wrapped in a banana leaf.  This dish is often eaten without utensils, and it is frequently served to visiting family and guests, as it is generally easily and quickly prepared.
Dr. Alejandro Barberena Pérez, in his 1971 book ""Granada,"" stated that María Luisa Cisneros Lacayo, ""La Loca,"" developed the recipe in 1914 in Granada, Nicaragua, and she named the dish Vigoron after seeing a poster advertising an early 20th-century medicinal tonic by that name (USPTO Serial 71068023).Many familial and cultural variants have arisen, especially in the variations of curtido. In addition, variants of vigorón exist in other surrounding countries, notably Costa Rica, where the dish is quite popular.
Vaho, a dish very similar to vigorón, is also a traditional Nicaraguan dish. However, a distinction is made in the manner of cooking:  vaho is pressure-cooked (typically brisket), vigorón is not.   Vaho also has green and ripe plantains, whereas Vigorón does not."
Pelau,"Palau ( (listen); Palauan: Belau, pronounced [ˈbɛlaw]), officially the Republic of Palau (Palauan: Beluu er a Palau) and historically Belau, Palaos or Pelew, is an island country in the western Pacific. The nation has approximately 340 islands and connects the western chain of the Caroline Islands with parts of the Federated States of Micronesia. It has a total area of 466 square kilometers (180 sq mi). The most populous island is Koror, home to the country's most populous city of the same name. The capital Ngerulmud is located on the nearby island of Babeldaob, in Melekeok State. Palau shares maritime boundaries with international waters to the north, the Federated States of Micronesia to the east, Indonesia to the south, and the Philippines to the northwest.
The country was originally settled approximately 3,000 years ago by migrants from Maritime Southeast Asia. Palau was first drawn on a European map by the Czech missionary Paul Klein based on a description given by a group of Palauans shipwrecked on the Philippine coast on Samar.  Palau islands were made part of the Spanish East Indies in 1885. Following Spain's defeat in the Spanish–American War in 1898, the islands were sold to Germany in 1899 under the terms of the German–Spanish Treaty, where they were administered as part of German New Guinea. After World War I, the islands were made a part of the Japanese-ruled South Seas Mandate by the League of Nations. During World War II, skirmishes, including the major Battle of Peleliu, were fought between American and Japanese troops as part of the Mariana and Palau Islands campaign. Along with other Pacific Islands, Palau was made a part of the United States-governed Trust Territory of the Pacific Islands in 1947. Having voted in a referendum against joining the Federated States of Micronesia in 1978, the islands gained full sovereignty in 1994 under a Compact of Free Association with the United States.
Politically, Palau is a presidential republic in free association with the United States, which provides defense, funding, and access to social services. Legislative power is concentrated in the bicameral Palau National Congress. Palau's economy is based mainly on tourism, subsistence agriculture and fishing, with a significant portion of gross national product (GNP) derived from foreign aid. The country uses the United States dollar as its currency. The islands' culture mixes Micronesian, Melanesian, Asian, and Western elements. Ethnic Palauans, the majority of the population, are of mixed Micronesian, Melanesian, and Austronesian descent. A smaller proportion of the population is of Japanese descent. The country's two official languages are Palauan (a member of the Austronesian language family) and English, with Japanese, Sonsorolese, and Tobian recognized as regional languages."
mala hot pot,"Chongqing hot pot (simplified Chinese: 重庆火锅; traditional Chinese: 重慶火鍋; pinyin: Chóngqìng huǒguō), also known as spicy hot pot, is usually eaten at restaurants, but otherwise is similar to roadside malatang. Chongqing hot pot is similar to the dry stir-fried mala xiang guo (麻辣香锅) which is also eaten in restaurants.The traditional way of preparing and eating this style of dish is to put the food in a hot pot, wait for the food to cook, and when the food is ready, dip the pieces in sesame oil and eat them. People choose various kinds of food to prepare in Chongqing hot pot, such as beef, pork, chicken, Chinese sausages, beef strips, pig blood, and duck intestine."
pizza cake,Canadian multiple-layer pizza baked in a pot or cake pan
Orzotto,"Orzotto (Italian pronunciation: [orˈdzɔtto]) is an Italian dish similar to risotto, but made with pearl barley instead of rice. Orzotti are a speciality of the Friuli Venezia Giulia region of northeastern Italy.The name is a portmanteau of orzo (the Italian word for barley) and risotto. This should not be confused with orzo, otherwise known as risoni, a type of wheat pasta formed into shapes resembling barley grains."
Pukala,"Pukālā (Nepalese language: पुकाला, ""fried meat"") is a traditional dish of boiled and fried variety meats of the water buffalo. The dish is a delicacy in the Newar cuisine of the Kathmandu Valley in Nepal and is enjoyed during wedding and festival feasts. It is served after the main course and before dessert.
Food is an important element in Newar ritual and religious life, and specific food preparations are required for ceremonies and feasts. Pukālā is a mandatory item during festivals. Today the dish is also served as an appetizer or snack in restaurants."
Aguachile,"Aguachile (“chile water” in Spanish) is a Mexican dish made of shrimp, submerged in liquid seasoned with chili peppers, lime juice, salt, cilantro, slices of cucumber and slices of onion. Raw vegetables such as cucumber are usually added. This raw seafood dish comes from the west region of Mexico and is normally prepared in a molcajete. The origin of aguachile lies in the coast of Sinaloa, originally made with boiled water and chiltepines, small round chili peppers from Sinaloa."
Mallung,"Mallung or mallum (Sinhala: මැල්ලුම්), is a shredded vegetable Sri Lankan dish that comprises lightly cooked/sautéed greens, with fresh coconut and any number of spices and chili. Mallung is a common condiment and is eaten at almost every meal. Most meals are usually served with one or two different mallungs, which play an important part in nutrition as this is how locals got a regular vitamin intake in their diet. The word 'mallung' or 'mallum' simply means 'wilted'.
The central ingredient of mallung is a leafy green vegetable, finely shredded which is then combined with a standard set of ingredients, to enhance and support their flavour. A number of different plants are used to make it, including cassia, passion fruit leaves, watercress or water spinach leaves. In western countries leafy vegetables, such as spinach, cabbage, chard and kale are used as substitutes for traditional Sri Lankan greens. In general, this selection comprises chopped green chillies, chopped shallots, chopped curry leaves, crushed garlic, a chopped clove of garlic together with half a cup of shredded coconut for every kilogram of moist leafy greens, seasoned with turmeric, salt and pepper, powdered maldive fish and lime juice.There are a range of bitter, medicinal and wild greens that are commonly used in mallung in Sri Lanka, with mostly the leaves of native plants used. One of the most popular mallungs is made with gotukola (Centella asiatica), other popular varieties include kankun (Ipomoea aquatica), kathurumurunga (Sesbania grandiflora) and mukunuwenna (Alternanthera sessilis). Other herbal leaves like aguna (Dregea volubilis), (Cheilocostus speciosus) and passionfruit leaves are also used in mallungs."
